url,ad_id,make,model,year,mileage_km,fuel,transmission,body_type,age_years,price_eur,pred_price_lo,pred_price_fair,pred_price_hi,deal_score,deal_label,seller_name,seller_rating,seller_reviews_count,images_count,options_count,language,title,currency,description,images,engine_liters,power_hp,power_kw,co2_gkm,consumption_l_100,color,doors,drivetrain_raw,turbo,euro_norm,price_per_km,options,specs_raw,km_per_year,options_text,desc_text
https://www.2ememain.be/v/autos/volvo/m2302463103-volvo-v60-b3-momentum-geartronic,2302463103,Volvo,V60,2021.0,72000.0,Essence,Automatique,Break,4.0,25800.0,21097.0,29065.0,32375.0,0.11233442284534664,fair,,,,37.0,44,fr,Volvo V60 B3 Momentum Geartronic,EUR,"#VO 2626 | Cette Volvo V60 provient du premier propriétaire belge, ne présente aucun dommage et est entièrement entretenue par un distributeur Volvo. Une fois vendue, la voiture est entièrement vérifiée, inspectée avant la vente et livrée, y compris le Carpass, le formulaire d'enregistrement et une garantie de 12 mois. Il est bien entendu possible de reprendre votre voiture actuelle : nous proposons toujours un prix compétitif pour votre voiture actuelle. Une extension de garantie jusqu'à 24 mois avec une couverture dans le pays et à l'étranger est possible. Votre intérêt a-t-il été éveillé ? Si vous avez des questions sur cette voiture ou si vous souhaitez obtenir des informations plus générales, n'hésitez pas à nous contacter. Nous serons heureux de vous informer personnellement lors de votre visite à notre bureau de Kerkrade. | Numéro de téléphone: (+32) 0469 155 433 | Pendant les heures d'ouverture, vous pouvez voir et/ou essayer nos voitures sans engagement au Tunnelweg 108, 6468EK à Kerkrade, aux Pays-Bas (à environ 20 minutes de Maasmechelen). Un essai routier est toujours possible, même sans rendez-vous. REMARQUE: Il s'agit d'une voiture belge d'origine immatriculée en Belgique. Nos horaires d'ouverture sont les suivants: du lundi au vendredi : de 10 h à 17 h 30 Le samedi : de 10 h à 14 h Le dimanche : fermé Notre adresse est : Tunnelweg 108, 6468 EK à Kerkrade Pays-Bas (à environ 20 minutes de Maasmechelen) Pour plus d'informations et un aperçu de nos 150 voitures, veuillez consulter notre site web: https:eurodecars.com/home-be/ Bien que nous essayions de faire de la publicité pour nos voitures de la manière la plus correcte possible, aucun droit ne peut être dérivé de nos publicités et des textes de nos sites Web.","['https://images.2dehands.com/api/v1/listing-twh-p/images/50/50d0cbe4-040e-43b6-945b-735f5ada77e4?rule=ecg_mp_eps$_85', 'https://images.2dehands.com/api/v1/listing-twh-p/images/90/9069d9e9-4424-4606-815d-bd146dfeacfb?rule=ecg_mp_eps$_83', 'https://images.2dehands.com/api/v1/listing-twh-p/images/cb/cb08a3f1-6fd0-4c55-a43c-913d1535bc37?rule=ecg_mp_eps$_83', 'https://images.2dehands.com/api/v1/listing-twh-p/images/1a/1a6f8c54-4314-46d2-a9bb-55b36aa4641c?rule=ecg_mp_eps$_83', 'https://images.2dehands.com/api/v1/profile-twh-p/images/57/5721c2e7-fed9-4ccc-a705-8cf14fd55041?rule=ecg_mp_eps$_82', 'https://images.2dehands.com/api/v1/profile-twh-p/images/fe/fe9b79d6-3b62-44d2-8480-adcab4bdfd35?rule=ecg_mp_eps$_82', 'https://images.2dehands.com/api/v1/profile-twh-p/images/19/19cf0255-25b0-49c1-bb5c-f0b5819c58fb?rule=ecg_mp_eps$_82', 'https://images.2dehands.com/api/v1/profile-twh-p/images/a2/a227547c-040c-4e54-96cf-abc0ec29a10e?rule=ecg_mp_eps$_82']",2.0,,,,,Argent ou Gris,,Roues avant,0.0,Euro 6,0.35833333333333334,"['ABS', 'Aide au maintien de voie', 'Air conditionné', 'Air conditionné automatique', 'Airbags', 'Android Auto', 'Anti démarrage', 'Apple Carplay', ""Assistance au freinage d'urgence"", 'Attache-remorque', 'Avertissement de sortie de voie', ""Avertisseur d'angle mort"", 'Barres de toit', 'Bluetooth', 'Caméra', 'Caméra de recul', 'Capteur de lumière', 'Capteur de pluie', 'Capteur de stationnement', 'Commande vocale', 'Cruise Control', 'Détection des panneaux routiers', 'Electronic Stability Program (ESP)', 'Feux de virage', 'Hayon arrière électrique', 'Interruption de démarrage', 'Intérieur cuir', 'Isofix', 'Jantes en alliage léger', 'Ordinateur de bord', 'Peinture métallisée', 'Radio', 'Régulateur de distance', 'Rétroviseurs extérieur chauffants', 'Rétroviseurs électriques', 'Sièges chauffants', 'Sièges électriques', 'Système Start/Stop', 'Système de navigation', 'USB', 'Verrouillage central', 'Verrouillage centralisé sans clé', 'Vitres électriques', 'Éclairage LED']","{'Marque & Modèle': 'Volvo V60', 'Année de fabrication': '2021', 'Kilométrage': '72.000 km', 'Carrosserie': 'Break', 'Couleur': 'Argent ou Gris', 'Garniture': 'Cuir', 'Intérieur': 'Noir', 'Transmission': 'Automatique', 'Cylindrée': '2.0 liter', 'Nombre de cylindres': '4', 'Turbo': 'Non', 'Propulsion ou traction': 'Roues avant', 'Carburant': 'Essence', 'Émissions de CO2': '147 g/km', 'Euronorm': 'Euro 6', 'Import voiture': 'Non', 'Entretien': 'Entretenue par le concessionnaire'}",18000.0,ABS Aide au maintien de voie Air conditionné Air conditionné automatique Airbags Android Auto Anti démarrage Apple Carplay Assistance au freinage d'urgence Attache-remorque Avertissement de sortie de voie Avertisseur d'angle mort Barres de toit Bluetooth Caméra Caméra de recul Capteur de lumière Capteur de pluie Capteur de stationnement Commande vocale Cruise Control Détection des panneaux routiers Electronic Stability Program (ESP) Feux de virage Hayon arrière électrique Interruption de démarrage Intérieur cuir Isofix Jantes en alliage léger Ordinateur de bord Peinture métallisée Radio Régulateur de distance Rétroviseurs extérieur chauffants Rétroviseurs électriques Sièges chauffants Sièges électriques Système Start/Stop Système de navigation USB Verrouillage central Verrouillage centralisé sans clé Vitres électriques Éclairage LED,"#VO 2626 | Cette Volvo V60 provient du premier propriétaire belge, ne présente aucun dommage et est entièrement entretenue par un distributeur Volvo. Une fois vendue, la voiture est entièrement vérifiée, inspectée avant la vente et livrée, y compris le Carpass, le formulaire d'enregistrement et une garantie de 12 mois. Il est bien entendu possible de reprendre votre voiture actuelle : nous proposons toujours un prix compétitif pour votre voiture actuelle. Une extension de garantie jusqu'à 24 mois avec une couverture dans le pays et à l'étranger est possible. Votre intérêt a-t-il été éveillé ? Si vous avez des questions sur cette voiture ou si vous souhaitez obtenir des informations plus générales, n'hésitez pas à nous contacter. Nous serons heureux de vous informer personnellement lors de votre visite à notre bureau de Kerkrade. | Numéro de téléphone: (+32) 0469 155 433 | Pendant les heures d'ouverture, vous pouvez voir et/ou essayer nos voitures sans engagement au Tunnelweg 108, 6468EK à Kerkrade, aux Pays-Bas (à environ 20 minutes de Maasmechelen). Un essai routier est toujours possible, même sans rendez-vous. REMARQUE: Il s'agit d'une voiture belge d'origine immatriculée en Belgique. Nos horaires d'ouverture sont les suivants: du lundi au vendredi : de 10 h à 17 h 30 Le samedi : de 10 h à 14 h Le dimanche : fermé Notre adresse est : Tunnelweg 108, 6468 EK à Kerkrade Pays-Bas (à environ 20 minutes de Maasmechelen) Pour plus d'informations et un aperçu de nos 150 voitures, veuillez consulter notre site web: https:eurodecars.com/home-be/ Bien que nous essayions de faire de la publicité pour nos voitures de la manière la plus correcte possible, aucun droit ne peut être dérivé de nos publicités et des textes de nos sites Web."
https://www.2ememain.be/v/autos/volvo/m2312943783-a-vendre-volvo-v60,2312943783,Volvo,V60,2018.0,138000.0,Diesel,Boîte manuelle,Break,7.0,16250.0,13440.0,15683.0,24088.0,-0.0361537971051457,fair,,,,6.0,0,fr,A vendre Volvo V60,EUR,"A vendre Volvo V60 2.0 diesel 150 ch de 09/2018. Le véhicule totalise 138000 km, est dans un état impeccable et sera bien sûr passé au CT. Peinture bleu métal, JA 17 pouces avec pneus 4 saisons neufs, airco auto., 4 vitres élec., pare-brise chauffant, hayon électrique, gps, ... La voiture est disponible immédiatement. Prix souhaité: 16250 euros. Si intéressé 0473/425261",['https://images.2dehands.com/api/v1/listing-twh-p/images/13/13aae09d-b012-49e4-93a3-61545ae9e0de?rule=ecg_mp_eps$_85'],2.0,,,,,Bleu,,,0.0,,0.11775362318840579,[],"{'Marque & Modèle': 'Volvo V60', 'Année de fabrication': '2018', 'Kilométrage': '138.000 km', 'Carrosserie': 'Break', 'Couleur': 'Bleu', 'Garniture': 'Cuir et Tissu', 'Intérieur': 'Noir', 'Transmission': 'Boîte manuelle', 'Cylindrée': '2.0 liter', 'Nombre de cylindres': '4', 'Turbo': 'Non', 'Carburant': 'Diesel', 'Import voiture': 'Non'}",19714.285714285714,,"A vendre Volvo V60 2.0 diesel 150 ch de 09/2018. Le véhicule totalise 138000 km, est dans un état impeccable et sera bien sûr passé au CT. Peinture bleu métal, JA 17 pouces avec pneus 4 saisons neufs, airco auto., 4 vitres élec., pare-brise chauffant, hayon électrique, gps, ... La voiture est disponible immédiatement. Prix souhaité: 16250 euros. Si intéressé 0473/425261"
https://www.2ememain.be/v/autos/volvo/m2312854076-volvo-v60-b3-mild-hybrid-plus-dark-627977-b3-mild-hybrid,2312854076,Volvo,V60 B3 Mild Hybrid Plus Dark: 627977 | B3 Mild Hybrid Plus Dark,2024.0,29900.0,Essence,Automatique,Break,1.0,38500.0,21018.0,42483.0,43792.0,0.09375514911847092,fair,,,,24.0,33,fr,Volvo V60 B3 Mild Hybrid Plus Dark: 627977 | B3 Mild Hybrid,EUR,"Zorgvuldig geselecteerd, onze Selekt wagens zijn altijd jonger dan 10 jaar en hebben minder dan 150.000 km op de teller staan. Gecontroleerd en up-to-date, elke auto wordt op ruim 160 punten gecontroleerd door onze techniekers en de software wordt geüpgraded met de nieuwste software versie. Garantie en assistentie, u krijgt minstens 12 maanden garantie zonder kilometerbeperking en assistentie van Volvo Assistance. Tevredenheidsgarantie, bevalt uw Volvo Selekt toch niet helemaal, dan mag u binnen 30 dagen of 1.500 km ruilen. Met meer dan 80 jaar automobiel ervaring waarvan 50 jaar Volvo is Van Kasteren een familiebedrijf waar u zich goed voelt! Wij zorgen voor een snelle en transparante service, op uw maat. Ons Selekt-center in Sint-Niklaas en Dendermonde biedt u een ruim aanbod aan kwalitatieve Volvo tweedehands auto’s. Met onze eigen carrosserie en ruim aanbod aan technische en financiële diensten bieden wij u een snelle en complete service. Sélectionnées avec soin, nos voitures Selekt ont toujours moins de 10 ans et moins de 150 000 km au compteur. Contrôlées et mises à jour, chaque voiture est vérifiée sur plus de 160 points par nos techniciens et le logiciel est mis à jour avec la dernière version. Garantie et assistance : vous bénéficiez d'une garantie d'au moins 12 mois sans limitation de kilométrage et de l'assistance Volvo Assistance. Garantie de satisfaction : si votre Volvo Selekt ne vous satisfait pas entièrement, vous pouvez l'échanger dans les 30 jours ou 1 500 km. Avec plus de 80 ans d'expérience dans le secteur automobile, dont 50 ans chez Volvo, Van Kasteren est une entreprise familiale où vous vous sentirez à l'aise ! Nous vous offrons un service rapide et transparent, adapté à vos besoins. Notre centre Selekt à Saint-Nicolas et Termonde vous propose une large gamme de voitures d'occasion Volvo de qualité. Grâce à notre propre carrosserie et à notre large gamme de services techniques et financiers, nous vous offrons un service rapide et complet.","['https://images.2dehands.com/api/v1/listing-twh-p/images/77/77f923bf-9ec6-4105-9467-8108b42b9f99?rule=ecg_mp_eps$_85', 'https://images.2dehands.com/api/v1/listing-twh-p/images/1d/1d618f02-5773-47d4-9881-ffeaf8cfd24a?rule=ecg_mp_eps$_83', 'https://images.2dehands.com/api/v1/listing-twh-p/images/2b/2b57bc29-54d7-4693-bf30-89348cc54b13?rule=ecg_mp_eps$_83', 'https://images.2dehands.com/api/v1/listing-twh-p/images/7c/7c513f7a-22e3-4214-99f9-a0476377077c?rule=ecg_mp_eps$_83']",2.0,,,,,Argent ou Gris,,,0.0,Euro 6,1.2876254180602007,"['ABS', 'Air conditionné', 'Airbags', 'Anti démarrage', ""Assistance au freinage d'urgence"", 'Bluetooth', 'Capteur de stationnement', 'Commande vocale', 'Cruise Control', 'Détection des panneaux routiers', 'Hayon arrière électrique', 'Intérieur cuir', 'Isofix', 'Jantes en alliage léger', 'Ordinateur de bord', 'Pack sport', 'Phares antibrouillard', 'Phares directionnels', 'Pilote automatique de stationnement', 'Radio', 'Régulateur de distance', 'Rétroviseurs extérieur chauffants', 'Rétroviseurs électriques', 'Sièges chauffants', 'Sièges sport', 'Sièges électriques', 'Système Start/Stop', 'Système de navigation', 'USB', 'Verrouillage central', 'Verrouillage centralisé sans clé', 'Vitres électriques', 'Volant chauffant']","{'Marque & Modèle': 'Volvo V60 B3 Mild Hybrid Plus Dark: 627977 | B3 Mild Hybrid Plus Dark', 'Version': '627977 | B3 Mild Hybrid Plus Dark', 'Année de fabrication': '2024', 'Kilométrage': '29.900 km', 'Carrosserie': 'Break', 'Couleur': 'Argent ou Gris', 'Transmission': 'Automatique', 'Cylindrée': '2.0 liter', 'Turbo': 'Non', 'Carburant': 'Essence', 'Émissions de CO2': '142 g/km', 'Euronorm': 'Euro 6', 'Import voiture': 'Non'}",29900.0,ABS Air conditionné Airbags Anti démarrage Assistance au freinage d'urgence Bluetooth Capteur de stationnement Commande vocale Cruise Control Détection des panneaux routiers Hayon arrière électrique Intérieur cuir Isofix Jantes en alliage léger Ordinateur de bord Pack sport Phares antibrouillard Phares directionnels Pilote automatique de stationnement Radio Régulateur de distance Rétroviseurs extérieur chauffants Rétroviseurs électriques Sièges chauffants Sièges sport Sièges électriques Système Start/Stop Système de navigation USB Verrouillage central Verrouillage centralisé sans clé Vitres électriques Volant chauffant,"Zorgvuldig geselecteerd, onze Selekt wagens zijn altijd jonger dan 10 jaar en hebben minder dan 150.000 km op de teller staan. Gecontroleerd en up-to-date, elke auto wordt op ruim 160 punten gecontroleerd door onze techniekers en de software wordt geüpgraded met de nieuwste software versie. Garantie en assistentie, u krijgt minstens 12 maanden garantie zonder kilometerbeperking en assistentie van Volvo Assistance. Tevredenheidsgarantie, bevalt uw Volvo Selekt toch niet helemaal, dan mag u binnen 30 dagen of 1.500 km ruilen. Met meer dan 80 jaar automobiel ervaring waarvan 50 jaar Volvo is Van Kasteren een familiebedrijf waar u zich goed voelt! Wij zorgen voor een snelle en transparante service, op uw maat. Ons Selekt-center in Sint-Niklaas en Dendermonde biedt u een ruim aanbod aan kwalitatieve Volvo tweedehands auto’s. Met onze eigen carrosserie en ruim aanbod aan technische en financiële diensten bieden wij u een snelle en complete service. Sélectionnées avec soin, nos voitures Selekt ont toujours moins de 10 ans et moins de 150 000 km au compteur. Contrôlées et mises à jour, chaque voiture est vérifiée sur plus de 160 points par nos techniciens et le logiciel est mis à jour avec la dernière version. Garantie et assistance : vous bénéficiez d'une garantie d'au moins 12 mois sans limitation de kilométrage et de l'assistance Volvo Assistance. Garantie de satisfaction : si votre Volvo Selekt ne vous satisfait pas entièrement, vous pouvez l'échanger dans les 30 jours ou 1 500 km. Avec plus de 80 ans d'expérience dans le secteur automobile, dont 50 ans chez Volvo, Van Kasteren est une entreprise familiale où vous vous sentirez à l'aise ! Nous vous offrons un service rapide et transparent, adapté à vos besoins. Notre centre Selekt à Saint-Nicolas et Termonde vous propose une large gamme de voitures d'occasion Volvo de qualité. Grâce à notre propre carrosserie et à notre large gamme de services techniques et financiers, nous vous offrons un service rapide et complet."
https://www.2ememain.be/v/autos/volvo/m2312685338-volvo-v60-2-0-t6-recharge-plus-awd-phev-geartronic,2312685338,Volvo,V60,2024.0,7823.0,Hybride Électrique/Essence,Automatique,Break,1.0,49995.0,21620.0,42155.0,46835.0,-0.1859803107579172,overpriced,,,,24.0,16,fr,Volvo V60 2.0 T6 RECHARGE PLUS AWD PHEV GEARTRONIC,EUR,VOLVO V60 2.0 T6 RECHARGE PLUS AWD PHEV GEARTRONIC Transmission: Automatique Année du modèle: 2024 Couleur: Bleu Puissance du moteur à combustion interne: 253 CH (186 kW) Nombre de places assises: 5 Émission de CO2 (WLTP): 17 g/km TVA/marge: TVA déductible Options et accessoires Antibrouillards avant Barres de toit Caméra de recul Capteurs de parking Climatisation bi-zone Commande vocale Direction assistée dépendante de la vitesse Feux de croisement automatiques Frein de stationnement électronique Hayon à commande électrique ISOFIX Kit bluetooth Poste de conduite numérique Régulateur de vitesse Support bras intermédiaire arrière Support bras intermédiaire avant Système de navigation Verre teinté Volant cuir Volant multifunction B2 Store North Michiganstraat 1 2030 Antwerpen Numéro de téléphone: +32 3 340 43 90 Adresse e-mail: b2.north@beerens.be,"['https://images.2dehands.com/api/v1/listing-twh-p/images/60/60a0a607-316c-420c-b1d4-cfdbb48bb6ca?rule=ecg_mp_eps$_85', 'https://images.2dehands.com/api/v1/profile-twh-p/images/60/60f2da6b-24d8-4a89-9eba-961f8e006de7?rule=ecg_mp_eps$_82', 'https://images.2dehands.com/api/v1/listing-twh-p/images/93/935bfccf-564c-446b-902a-c9a24c6f066e?rule=ecg_mp_eps$_83', 'https://images.2dehands.com/api/v1/listing-twh-p/images/3e/3e82b08a-203d-4140-812c-f86038e7460f?rule=ecg_mp_eps$_83', 'https://images.2dehands.com/api/v1/listing-twh-p/images/ab/ab8cee0e-82c0-4bea-90f0-c647b668783a?rule=ecg_mp_eps$_83']",2.0,,,,,Bleu,,4x4 permanent,0.0,Euro 6,6.390770804039371,"['4x4', 'Air conditionné', 'Air conditionné automatique', 'Barres de toit', 'Bluetooth', 'Caméra', 'Caméra de recul', 'Capteur de lumière', 'Capteur de stationnement', 'Commande vocale', 'Cruise Control', 'Hayon arrière électrique', 'Intérieur cuir', 'Isofix', 'Phares antibrouillard', 'Système de navigation']","{'Marque & Modèle': 'Volvo V60', 'Version': '2.0 T6 RECHARGE PLUS AWD PHEV GEARTRONIC', 'Année de fabrication': '2024', 'Kilométrage': '7.823 km', 'Carrosserie': 'Break', 'Couleur': 'Bleu', 'Garniture': 'Cuir', 'Transmission': 'Automatique', 'Cylindrée': '2.0 liter', 'Turbo': 'Non', 'Propulsion ou traction': '4x4 permanent', 'Carburant': 'Hybride Électrique/Essence', 'Émissions de CO2': '17 g/km', 'Euronorm': 'Euro 6', 'État': 'Occasion', 'Import voiture': 'Non'}",7823.0,4x4 Air conditionné Air conditionné automatique Barres de toit Bluetooth Caméra Caméra de recul Capteur de lumière Capteur de stationnement Commande vocale Cruise Control Hayon arrière électrique Intérieur cuir Isofix Phares antibrouillard Système de navigation,VOLVO V60 2.0 T6 RECHARGE PLUS AWD PHEV GEARTRONIC Transmission: Automatique Année du modèle: 2024 Couleur: Bleu Puissance du moteur à combustion interne: 253 CH (186 kW) Nombre de places assises: 5 Émission de CO2 (WLTP): 17 g/km TVA/marge: TVA déductible Options et accessoires Antibrouillards avant Barres de toit Caméra de recul Capteurs de parking Climatisation bi-zone Commande vocale Direction assistée dépendante de la vitesse Feux de croisement automatiques Frein de stationnement électronique Hayon à commande électrique ISOFIX Kit bluetooth Poste de conduite numérique Régulateur de vitesse Support bras intermédiaire arrière Support bras intermédiaire avant Système de navigation Verre teinté Volant cuir Volant multifunction B2 Store North Michiganstraat 1 2030 Antwerpen Numéro de téléphone: +32 3 340 43 90 Adresse e-mail: b2.north@beerens.be
https://www.2ememain.be/v/autos/volvo/m2301913593-volvo-v60-d3-45000-km-momentum-pro,2301913593,Volvo,V60,2020.0,45000.0,Diesel,Automatique,Break,5.0,24900.0,18865.0,25636.0,29255.0,0.028709627086909034,fair,,,,11.0,47,fr,Volvo V60 d3 45000 km momentum pro+,EUR,"Volvo 2.0 diesel de 150 cv version momentum pro+ boîte auto voiture full option il n'y manque le cuir ,le kit r design et toit ouvrant . système de conduite autonome ,siège chauffant ,camera ,etc...la liste des options est très longue . premier propriétaire voiture belge de 2020 carnet complet Volvo Prix 24900 euro","['https://images.2dehands.com/api/v1/listing-twh-p/images/f1/f19b4923-3f94-4f63-bc2e-991a6fd7988d?rule=ecg_mp_eps$_85', 'https://images.2dehands.com/api/v1/listing-twh-p/images/60/604d0068-eb7c-4ef7-a676-c1c68c816c07?rule=ecg_mp_eps$_83', 'https://images.2dehands.com/api/v1/dm-listing-twh-p/images/8c/8c5a8c2c-7d16-4b00-ab39-28e6ada54639?rule=ecg_mp_eps$_83']",2.0,,,,,Noir,,Roues avant,0.0,Euro 6,0.5533333333333333,"['ABS', 'Aide au maintien de voie', 'Air conditionné', 'Air conditionné automatique', 'Airbags', 'Alarme', 'Android Auto', 'Anti démarrage', 'Apple Carplay', ""Assistance au freinage d'urgence"", 'Avertissement de sortie de voie', ""Avertisseur d'angle mort"", 'Barres de toit', 'Bluetooth', 'Caméra', 'Caméra de recul', 'Capteur de lumière', 'Capteur de pluie', 'Capteur de stationnement', 'Commande vocale', 'Conduite autonome', 'Cruise Control', 'Détection des panneaux routiers', 'Electronic Stability Program (ESP)', 'Feux de virage', 'Hayon arrière électrique', 'Interruption de démarrage', 'Isofix', 'Jantes en alliage léger', 'Ordinateur de bord', 'Peinture métallisée', 'Phares antibrouillard', 'Radio', 'Régulateur de distance', 'Rétroviseurs extérieur chauffants', 'Rétroviseurs électriques', 'Sièges chauffants', 'Sièges électriques', 'Système Start/Stop', 'Système de détection de la somnolence', 'Système de navigation', 'USB', 'Verrouillage central', 'Verrouillage centralisé sans clé', 'Vitres électriques', 'Volant chauffant', 'Éclairage LED']","{'Marque & Modèle': 'Volvo V60', 'Année de fabrication': '2020', 'Kilométrage': '45.000 km', 'Carrosserie': 'Break', 'Couleur': 'Noir', 'Garniture': 'Tissu', 'Intérieur': 'Noir', 'Transmission': 'Automatique', 'Cylindrée': '2.0 liter', 'Nombre de cylindres': '4', 'Turbo': 'Non', 'Propulsion ou traction': 'Roues avant', 'Carburant': 'Diesel', 'Euronorm': 'Euro 6', 'Import voiture': 'Non', 'Entretien': 'Entretenue par le concessionnaire'}",9000.0,ABS Aide au maintien de voie Air conditionné Air conditionné automatique Airbags Alarme Android Auto Anti démarrage Apple Carplay Assistance au freinage d'urgence Avertissement de sortie de voie Avertisseur d'angle mort Barres de toit Bluetooth Caméra Caméra de recul Capteur de lumière Capteur de pluie Capteur de stationnement Commande vocale Conduite autonome Cruise Control Détection des panneaux routiers Electronic Stability Program (ESP) Feux de virage Hayon arrière électrique Interruption de démarrage Isofix Jantes en alliage léger Ordinateur de bord Peinture métallisée Phares antibrouillard Radio Régulateur de distance Rétroviseurs extérieur chauffants Rétroviseurs électriques Sièges chauffants Sièges électriques Système Start/Stop Système de détection de la somnolence Système de navigation USB Verrouillage central Verrouillage centralisé sans clé Vitres électriques Volant chauffant Éclairage LED,"Volvo 2.0 diesel de 150 cv version momentum pro+ boîte auto voiture full option il n'y manque le cuir ,le kit r design et toit ouvrant . système de conduite autonome ,siège chauffant ,camera ,etc...la liste des options est très longue . premier propriétaire voiture belge de 2020 carnet complet Volvo Prix 24900 euro"
https://www.2ememain.be/v/autos/volvo/m2312375334-volvo-v60-v60-2-0-t6-awd-phev-inscription-expression,2312375334,Volvo,V60,2021.0,87593.0,Hybride Électrique/Essence,Automatique,Break,4.0,28490.0,20406.0,28528.0,30889.0,0.001332024677509815,fair,,,,20.0,7,fr,Volvo V60 V60 2.0 T6 AWD PHEV Inscription Expression,EUR,"Kilometerstand: 87593, Gewicht: 2550 kg, Motorvermogen: 253 pk, Co2: 42, Automaat 8 versnellingen, Navigatiesysteem, Middenarmsteun, Verwarmde stoelen, DSC, Airco, Stuurbekrachtiging, ABS, Lederen bekleding, Elektrische ramen, Cruice-control, Transaction control, Airbag passagier, Airbag bestuurder, Airbag passagier, Btw aftrekbaar REF 36058 - PARKING 783","['https://images.2dehands.com/api/v1/listing-twh-p/images/15/15efab9f-69d4-4b10-b062-de53db5453f0?rule=ecg_mp_eps$_85', 'https://images.2dehands.com/api/v1/listing-twh-p/images/98/9866dd9f-701f-4e49-978a-c7abfa6b8a0f?rule=ecg_mp_eps$_83', 'https://images.2dehands.com/api/v1/listing-twh-p/images/ae/aee54da7-e9ef-48d4-8f9b-b32a5f248f58?rule=ecg_mp_eps$_83', 'https://images.2dehands.com/api/v1/listing-twh-p/images/d5/d544c5de-11f6-4fbd-85cb-cf1c16be3569?rule=ecg_mp_eps$_83']",,,,,,Argent ou Gris,,,0.0,,0.32525430114278536,"['ABS', 'Air conditionné', 'Airbags', 'Cruise Control', 'Intérieur cuir', 'Système de navigation', 'Vitres électriques']","{'Marque & Modèle': 'Volvo V60', 'Année de fabrication': '2021', 'Kilométrage': '87.593 km', 'Carrosserie': 'Break', 'Couleur': 'Argent ou Gris', 'Transmission': 'Automatique', 'Turbo': 'Non', 'Carburant': 'Hybride Électrique/Essence', 'Émissions de CO2': '42 g/km', 'Import voiture': 'Non'}",21898.25,ABS Air conditionné Airbags Cruise Control Intérieur cuir Système de navigation Vitres électriques,"Kilometerstand: 87593, Gewicht: 2550 kg, Motorvermogen: 253 pk, Co2: 42, Automaat 8 versnellingen, Navigatiesysteem, Middenarmsteun, Verwarmde stoelen, DSC, Airco, Stuurbekrachtiging, ABS, Lederen bekleding, Elektrische ramen, Cruice-control, Transaction control, Airbag passagier, Airbag bestuurder, Airbag passagier, Btw aftrekbaar REF 36058 - PARKING 783"
