url,ad_id,make,model,year,mileage_km,fuel,transmission,body_type,age_years,price_eur,pred_price_lo,pred_price_fair,pred_price_hi,deal_score,deal_label,seller_name,seller_rating,seller_reviews_count,images_count,options_count,language,title,currency,description,images,engine_liters,power_hp,power_kw,co2_gkm,consumption_l_100,color,doors,drivetrain_raw,turbo,euro_norm,price_per_km,options,specs_raw,km_per_year,options_text,desc_text
https://www.2ememain.be/v/autos/volvo/m2317569973-volvo-v60-1-6-drive-r-design-leer-xenon-dvd-trekhaak,2317569973,Volvo,V60,2012.0,262213.0,Diesel,Boîte manuelle,Break,13.0,6450.0,3405.0,4773.0,23867.0,-0.35135135135135137,fair,,,,24.0,33,fr,Volvo V60 1.6 DRIVe R-Design Leer Xenon DVD Trekhaak,EUR,"Volvo V60 1.6 DRIVe R-Design Leer Xenon DVD Trekhaak Kenteken: PR-554-FMerk: VolvoModel: V60Tellerstand: 262213 KMCarrosserievorm: StationAantal deuren: 5Brandstofsoort: DieselBouwjaar: 2012Transmissie:... Volvo V60 1.6 DRIVe R-Design Leer Xenon DVD Trekhaak Informations générales Code du modèle: V60 I Couleur: Bleu métallisé Performances Vitesse de pointe: 190 km/h Mesures et poids Capacité de charge: 673 kg PBV: 2.110 kg Hauteur: 1479 cm Empattement: 278 cm Intérieur Couleur intérieure: brun Nombre de places assises: 5 Environnement Label énergétique: A Entretien, historique et condition Livrets: Présent Dommages: aucun Nombre de clés: 2 ( 2 télécommandes) Informations financières TVA/marge: TVA non déductible (régime de la marge bénéficiaire) Options et accessoires Airbag chauffeur Airbag passager Airbags de tête arrière Airbags de tête avant Airbags latéraux avant Assistance au freinage d'urgence Atténuation des collisions par freinage Avertissement trafic arrière Banquette arrière rabattables en plusieurs parties Capteur de pluie Capteurs de parking Capteurs de parking arrière Capteurs de parking avant et arrière Châssis sport Climate control Commande vocale Contrôle de la stabilité Couverture de bagages Crochet de traction Crochet de traction avec boule amovible Direction assistée Essuie-glace arrière Fenêtres électriques à l'avant et à l'arrière Intérieur cuir ISOFIX Kit bluetooth Multimédia activé Ordinateur de bord Peinture métallisée Phares orientables Radio/Lecteur CD Radio avec lecteur MP3 Revêtement cuir Revêtement semi-cuir Roues en métal léger (18"") Réglage antidérapant Régulateur de vitesse Répartition électronique de la force de freinage Rétroviseurs extérieurs chauffants Rétroviseurs extérieurs à réglage électrique Siège chauffant à l'avant Siège chauffeur à commande électrique avec mémoire Sièges avant réglables en hauteur Sièges avant à commande électrique Sièges sport Starter Support bras intermédiaire arrière Support bras intermédiaire avant Système antiblocage Système d'alarme classe I Système de navigation Système Start/stop Verre teinté Verrouillage centralisé à distance Volant multifunction Volant réglable Volant sport Éclairage bi-xénon Éclairage de jour LED Remarques Volvo V60 1.6 DRIVe R-Design Leer Xenon DVD Trekhaak Kenteken: PR-554-F Merk: Volvo Model: V60 Tellerstand: 262213 KM Carrosserievorm: Station Aantal deuren: 5 Brandstofsoort: Diesel Bouwjaar: 2012 Transmissie: Handgeschakeld Kleur: blauw Metallic Bekleding: Leder Kleur interieur: bruin Motorinhoud: 1560 cc Aantal cilinders: 4 Motorcode: D4162T Vermogen: 84 kW / 114pk Ledig gewicht: 1437 kg Max. trekgewicht: 1300 kg Aantal zitplaatsen: 5 Verbruik: 4.5 l/100 km BTW/Marge: Marge, de BTW is niet aftrekbaar Lengte: 463 cm Hoogte: 1479 cm Aantal sleutels: 2 Onderhoudshistorie aanwezig: Ja Motorrijtuigenbelasting: € 447 - 469 per kwartaal Emissieklasse: Euro 5 Pakket: Business Pack Pro Audio installatie Bluetooth Metaalkleur Navigatiesysteem full map + hard disk Parkeersensor achter Spraakbediening Pakket: Winter Line Bi-xenon koplampen Bi-xenon koplampen adaptief Koplampen adaptief Koplampreiniging Voorstoelen verwarmd Comfort Boordcomputer Cruise control Regensensor Exterieur Achterruitwisser Bi-xenon koplampen Bi-xenon koplampen adaptief Buitenspiegels elektrisch verstel- en verwarmbaar Centrale vergrendeling Centrale vergrendeling met afstandsbediening Extra getint glas achter Getint glas LED dagrijverlichting Lichtmetalen velgen 18"" Metaalkleur Park Distance Control Parkeersensor achter Parkeersensor voor en achter Premium kleur Ruitensproeiers/wisserbladen verwarmbaar Sportonderstel Sportvelgen Trekhaak Trekhaak met afneembare kogel Infotainment Audio installatie premium Multimedia-voorbereiding Navigatiesysteem Radio-CD/MP3 speler Stuur multifunctioneel Interieur Achterbank in delen neerklapbaar Airco Aluminium interieur afwerking Armsteun achter Armsteun voor Bagage-scheidingsnet Bagagedek Electronic climate control Elektrisch verstelb. bestuurdersstoel met geheugen Elektrisch verstelbare passagiersstoel Elektrische ramen voor Elektrische ramen voor en achter Hoofdsteunen anti-whiplash Lederen bekleding Lederen interieur Lederen/stof bekleding Lendesteun(en) verstelbaar Middenarmsteun voor Sportstoelen Sportstuur Stuur en versnellingspook (kunst)leder Stuur verstelbaar Stuurbekrachtiging Voorstoelen in hoogte verstelbaar Voorstoelen verwarmd Milieu Start/stop systeem Overige Achteropkomend verkeer waarschuwing Anti Blokkeer Systeem Anti doorSlip Regeling Autonomous Emergency Braking Bestuurdersairbag Bots herkenning en activatie Brake Assist System Elektronisch Stabiliteits Programma Elektronische remkrachtverdeling Hoofd airbag(s) achter Hoofd airbag(s) voor Passagiersairbag R-Design exterieur Zij airbag(s) voor Veiligheid Alarm klasse 1(startblokkering) Isofix bevestiging voor kinderzitjes Bij Auto vd Woude zijn alle prijzen incl. rijklaarkosten! (mits anders gemeld) PRIJS IS RIJKLAAR! * 3 Maanden Garantie op motor en versnellingsbak * Afleverbeurt volgens onderhoudsschema van de betreffende fabrikant *Airco beurt * Nieuwe APK-keuring indien noodzakelijk * Gratis vervangend vervoer tijdens garantiewerkzaamheden * Poetsen * U bent welkom om deze auto te komen bezichtigen. Inruil is mogelijk. Openingstijden: Verkoop: maandag-vrijdag 09:00-17:30 Zaterdag 09:00-17:00 Buiten deze openingstijden ook op afspraak mogelijk. Telefoon: 0513-462787 of via Whatsapp 06-45885569 Auto vd Woude stationsweg 86A 8401DT Gorredijk 0513462787 verkoop@autovdwoude.nl www.autovdwoude.nl We hebben ons uiterste best gedaan om alle informatie in deze advertentie correct weer te geven. Er kunnen echter geen rechten worden ontleend aan de verstrekte informatie in de advertentie. Vertrouw niet alleen op deze informatie maar controleert u altijd zelf de zaken welke voor u belangrijk zijn en uw beslissing zouden kunnen beïnvloeden. Neem contact op met de verkoper voor uw aanvullende vragen. Auto vd Woude stationsweg 86A 8401DT Gorredijk Netherlands Numéro de téléphone: 0513462787 Adresse e-mail: verkoop@autovdwoude.nl","['https://images.2dehands.com/api/v1/listing-twh-p/images/96/96bfab08-b5fa-4ae9-a37b-932250ab55f3?rule=ecg_mp_eps$_85', 'https://images.2dehands.com/api/v1/listing-twh-p/images/f5/f5e28f64-a542-4b21-8f80-5a19d08bf939?rule=ecg_mp_eps$_83', 'https://images.2dehands.com/api/v1/listing-twh-p/images/05/05e419de-d17a-46a2-8071-f612a52d35f5?rule=ecg_mp_eps$_83', 'https://images.2dehands.com/api/v1/listing-twh-p/images/0f/0ff475d9-8482-4723-a8be-1a8822455302?rule=ecg_mp_eps$_83']",1.6,,,,,Bleu,,Roues avant,0.0,Euro 5,0.024598322737621706,"['ABS', 'Air conditionné', 'Air conditionné automatique', 'Airbags', 'Alarme', 'Anti démarrage', ""Assistance au freinage d'urgence"", 'Attache-remorque', 'Bluetooth', 'Capteur de pluie', 'Capteur de stationnement', 'Commande vocale', 'Cruise Control', 'Electronic Stability Program (ESP)', 'Feux de virage', 'Interruption de démarrage', 'Intérieur cuir', 'Isofix', 'Jantes en alliage léger', 'Ordinateur de bord', 'Peinture métallisée', 'Phares au xénon', 'Radio', 'Rétroviseurs extérieur chauffants', 'Rétroviseurs électriques', 'Sièges chauffants', 'Sièges sport', 'Sièges électriques', 'Système Start/Stop', 'Système de navigation', 'Verrouillage central', 'Vitres électriques', 'Éclairage LED']","{'Marque & Modèle': 'Volvo V60', 'Version': '1.6 DRIVe R-Design Leer Xenon DVD Trekhaak', 'Année de fabrication': '2012', 'Kilométrage': '262.213 km', 'Carrosserie': 'Break', 'Couleur': 'Bleu', 'Garniture': 'Cuir', 'Intérieur': 'Brun', 'Transmission': 'Boîte manuelle', 'Cylindrée': '1.6 liter', 'Nombre de cylindres': '4', 'Turbo': 'Non', 'Propulsion ou traction': 'Roues avant', 'Carburant': 'Diesel', 'Consommation': '4.5 L/100 KM', 'Émissions de CO2': '119 g/km', 'Euronorm': 'Euro 5', 'Étiquette énergie': 'A', 'État': 'Occasion', 'Import voiture': 'Non', 'Entretien': ""Carnet d''entretien""}",20170.23076923077,ABS Air conditionné Air conditionné automatique Airbags Alarme Anti démarrage Assistance au freinage d'urgence Attache-remorque Bluetooth Capteur de pluie Capteur de stationnement Commande vocale Cruise Control Electronic Stability Program (ESP) Feux de virage Interruption de démarrage Intérieur cuir Isofix Jantes en alliage léger Ordinateur de bord Peinture métallisée Phares au xénon Radio Rétroviseurs extérieur chauffants Rétroviseurs électriques Sièges chauffants Sièges sport Sièges électriques Système Start/Stop Système de navigation Verrouillage central Vitres électriques Éclairage LED,"Volvo V60 1.6 DRIVe R-Design Leer Xenon DVD Trekhaak Kenteken: PR-554-FMerk: VolvoModel: V60Tellerstand: 262213 KMCarrosserievorm: StationAantal deuren: 5Brandstofsoort: DieselBouwjaar: 2012Transmissie:... Volvo V60 1.6 DRIVe R-Design Leer Xenon DVD Trekhaak Informations générales Code du modèle: V60 I Couleur: Bleu métallisé Performances Vitesse de pointe: 190 km/h Mesures et poids Capacité de charge: 673 kg PBV: 2.110 kg Hauteur: 1479 cm Empattement: 278 cm Intérieur Couleur intérieure: brun Nombre de places assises: 5 Environnement Label énergétique: A Entretien, historique et condition Livrets: Présent Dommages: aucun Nombre de clés: 2 ( 2 télécommandes) Informations financières TVA/marge: TVA non déductible (régime de la marge bénéficiaire) Options et accessoires Airbag chauffeur Airbag passager Airbags de tête arrière Airbags de tête avant Airbags latéraux avant Assistance au freinage d'urgence Atténuation des collisions par freinage Avertissement trafic arrière Banquette arrière rabattables en plusieurs parties Capteur de pluie Capteurs de parking Capteurs de parking arrière Capteurs de parking avant et arrière Châssis sport Climate control Commande vocale Contrôle de la stabilité Couverture de bagages Crochet de traction Crochet de traction avec boule amovible Direction assistée Essuie-glace arrière Fenêtres électriques à l'avant et à l'arrière Intérieur cuir ISOFIX Kit bluetooth Multimédia activé Ordinateur de bord Peinture métallisée Phares orientables Radio/Lecteur CD Radio avec lecteur MP3 Revêtement cuir Revêtement semi-cuir Roues en métal léger (18"") Réglage antidérapant Régulateur de vitesse Répartition électronique de la force de freinage Rétroviseurs extérieurs chauffants Rétroviseurs extérieurs à réglage électrique Siège chauffant à l'avant Siège chauffeur à commande électrique avec mémoire Sièges avant réglables en hauteur Sièges avant à commande électrique Sièges sport Starter Support bras intermédiaire arrière Support bras intermédiaire avant Sy"
https://www.2ememain.be/v/autos/volvo/m2317543240-volvo-v60-v60-b3-geartronic-momentum-pro-leder-camera-carply,2317543240,Volvo,V60,2021.0,42072.0,Essence,Automatique,Break,4.0,29500.0,21703.0,31049.0,34108.0,0.049888885310315954,fair,,,,5.0,41,fr,Volvo V60 V60 B3 Geartronic Momentum Pro Leder/Camera/Carply,EUR,"Consommation moyenne de carburant: 6,1 l/100km Entretenu conformément à la réglementation: oui Dommages: aucun Leconte Motors biedt u aan: Volvo V60 B3 Momentum Pro Geartronic Onderhoudshistoriek bij... Volvo V60 V60 B3 Geartronic Momentum Pro Leder/Camera/Carply Transmission: 8 vitesses, Automatique Couleur: Gris métallisé Couleur intérieure: noir Nombre de places assises: 5 Classe d'émission: Euro 6d Nombre de propriétaires: 1 Garantie: 12 mois Options et accessoires Aide à la conduite ABS Alerte de franchissement involontaire de lignes Assistant au freinage d'urgence Assistant de démarrage en côte Avertisseur d'angle mort Caméra d'aide au stationnement Capteurs d'aide au stationnement arrière Capteurs d'aide au stationnement avant Contrôle de la Distance de Stationnement Direction assistée Détection des panneaux routiers ESP Ordinateur de bord Régulateur de vitesse Start/Stop automatique Système de navigation Autres Véhicule non-fumeur Confort Accoudoir Climatisation automatique Commande vocale Sièges chauffants Sièges sport Sièges électriques Siège à réglage lombaire Volant en cuir Volant multifonctions Extra Attache remorque Dispositif mains libres Détecteur de lumière Détecteur de pluie Pack Sport Rétroviseurs latéraux électriques Trappe à ski Verrouillage centralisé Verrouillage centralisé avec télécommande Extérieur Hayon arrière électrique Jantes alliage LED Phare de jour Pare-brise chauffant Phares au LED Porte-bagages Pot catalytique Vitres électriques Multimédia Android Auto Apple CarPlay Bluetooth Ecran tactile MP3 Radio Radio numérique Soundsystem USB Sécurité Airbag arrière Airbag conducteur Airbag passager Airbags latéraux Anti-démarrage Anti-patinage Isofix Système d'appel d'urgence Système de contrôle de la pression pneus Système de détection de la somnolence Remarques Consommation moyenne de carburant: 6,1 l/100km Entretenu conformément à la réglementation: oui Dommages: aucun Leconte Motors biedt u aan: Volvo V60 B3 Momentum Pro Geartronic Onderhoudshistoriek bij Volvo 2 sleutels 1e eigenaar Belgische wagen Rookvrij Opties: ABS Isofix Cruise-Control Lederen comfortzetels Zetelverwarming Elektrisch zetelverstelling + geheugenfunctie Camera Carplay Parkeersensoren Automatische airco Multifunctioneel stuur Elektrisch verstelbare spiegels Trekhaak Privacyglas Elektrische kofferklep Navigatiesysteem Bluetooth Handsfree bellen USB aansluiting 17' Alu velgen Start/stop Enz... Wagen word afgeleverd met blanco keuring+aanvraag tot inschrijving+car-pass. Service na verkoop: Onderhoudsdienst na de aankoop vd wagen 1 JAAR WAARBORG 29.500 euro Btw incl/aftrekbaar Financieringsdienst, breng gerust jullie laatste 3 loonfiches+identiteitskaart mee* Word voorzien voor aflevering van: onderhoud volledige voertuig check-up complete niveaucontrole controle vd batterij Bij intresse gelieve steeds telefonisch een afspraak te maken! Wij zijn ook open op Zaterdag! Hopelijk tot binnenkort! Leconte Motors Bvba Deerlijkstraat 227D 8550 Zwevegem 0474.31.11.72 Leconte Motors Deerlijkstraat 227d 8550 Zwevegem Numéro de téléphone: +32474311172 Adresse e-mail: leconte.motors@gmail.com","['https://images.2dehands.com/api/v1/listing-twh-p/images/07/07a9c4c6-fc54-472f-b280-704d12e6cd7c?rule=ecg_mp_eps$_85', 'https://images.2dehands.com/api/v1/dm-profile-twh-p/images/25/258c3d57-442a-4c2b-932c-e7090c6f3502?rule=ecg_mp_eps$_82', 'https://images.2dehands.com/api/v1/listing-twh-p/images/c9/c9d1f536-cfa8-4cfe-9fdd-2fa0962eb3f2?rule=ecg_mp_eps$_83', 'https://images.2dehands.com/api/v1/listing-twh-p/images/02/0224d9db-be0d-400c-9b6c-4856984cd71a?rule=ecg_mp_eps$_83', 'https://images.2dehands.com/api/v1/listing-twh-p/images/ba/bac1856a-c871-46cf-922c-108d3514bf4c?rule=ecg_mp_eps$_83']",2.0,,,,,Argent ou Gris,,,0.0,Euro 6,0.701178931355771,"['ABS', 'Air conditionné', 'Air conditionné automatique', 'Airbags', 'Android Auto', 'Anti démarrage', 'Apple Carplay', ""Assistance au freinage d'urgence"", 'Attache-remorque', 'Avertissement de sortie de voie', ""Avertisseur d'angle mort"", 'Bluetooth', 'Caméra', 'Caméra de recul', 'Capteur de lumière', 'Capteur de pluie', 'Capteur de stationnement', 'Commande vocale', 'Cruise Control', 'Détection des panneaux routiers', 'Electronic Stability Program (ESP)', 'Hayon arrière électrique', 'Interruption de démarrage', 'Intérieur cuir', 'Isofix', 'Jantes en alliage léger', 'Ordinateur de bord', 'Pack sport', 'Peinture métallisée', 'Radio', 'Rétroviseurs électriques', 'Sièges chauffants', 'Sièges sport', 'Sièges électriques', 'Système Start/Stop', 'Système de détection de la somnolence', 'Système de navigation', 'USB', 'Verrouillage central', 'Vitres électriques', 'Éclairage LED']","{'Marque & Modèle': 'Volvo V60', 'Version': 'V60 B3 Geartronic Momentum Pro Leder/Camera/Carply', 'Année de fabrication': '2021', 'Kilométrage': '42.072 km', 'Carrosserie': 'Break', 'Couleur': 'Argent ou Gris', 'Garniture': 'Cuir', 'Intérieur': 'Noir', 'Transmission': 'Automatique', 'Cylindrée': '2.0 liter', 'Nombre de cylindres': '4', 'Turbo': 'Non', 'Carburant': 'Essence', 'Émissions de CO2': '147 g/km', 'Euronorm': 'Euro 6', 'État': 'Occasion', 'Import voiture': 'Non'}",10518.0,ABS Air conditionné Air conditionné automatique Airbags Android Auto Anti démarrage Apple Carplay Assistance au freinage d'urgence Attache-remorque Avertissement de sortie de voie Avertisseur d'angle mort Bluetooth Caméra Caméra de recul Capteur de lumière Capteur de pluie Capteur de stationnement Commande vocale Cruise Control Détection des panneaux routiers Electronic Stability Program (ESP) Hayon arrière électrique Interruption de démarrage Intérieur cuir Isofix Jantes en alliage léger Ordinateur de bord Pack sport Peinture métallisée Radio Rétroviseurs électriques Sièges chauffants Sièges sport Sièges électriques Système Start/Stop Système de détection de la somnolence Système de navigation USB Verrouillage central Vitres électriques Éclairage LED,"Consommation moyenne de carburant: 6,1 l/100km Entretenu conformément à la réglementation: oui Dommages: aucun Leconte Motors biedt u aan: Volvo V60 B3 Momentum Pro Geartronic Onderhoudshistoriek bij... Volvo V60 V60 B3 Geartronic Momentum Pro Leder/Camera/Carply Transmission: 8 vitesses, Automatique Couleur: Gris métallisé Couleur intérieure: noir Nombre de places assises: 5 Classe d'émission: Euro 6d Nombre de propriétaires: 1 Garantie: 12 mois Options et accessoires Aide à la conduite ABS Alerte de franchissement involontaire de lignes Assistant au freinage d'urgence Assistant de démarrage en côte Avertisseur d'angle mort Caméra d'aide au stationnement Capteurs d'aide au stationnement arrière Capteurs d'aide au stationnement avant Contrôle de la Distance de Stationnement Direction assistée Détection des panneaux routiers ESP Ordinateur de bord Régulateur de vitesse Start/Stop automatique Système de navigation Autres Véhicule non-fumeur Confort Accoudoir Climatisation automatique Commande vocale Sièges chauffants Sièges sport Sièges électriques Siège à réglage lombaire Volant en cuir Volant multifonctions Extra Attache remorque Dispositif mains libres Détecteur de lumière Détecteur de pluie Pack Sport Rétroviseurs latéraux électriques Trappe à ski Verrouillage centralisé Verrouillage centralisé avec télécommande Extérieur Hayon arrière électrique Jantes alliage LED Phare de jour Pare-brise chauffant Phares au LED Porte-bagages Pot catalytique Vitres électriques Multimédia Android Auto Apple CarPlay Bluetooth Ecran tactile MP3 Radio Radio numérique Soundsystem USB Sécurité Airbag arrière Airbag conducteur Airbag passager Airbags latéraux Anti-démarrage Anti-patinage Isofix Système d'appel d'urgence Système de contrôle de la pression pneus Système de détection de la somnolence Remarques Consommation moyenne de carburant: 6,1 l/100km Entretenu conformément à la réglementation: oui Dommages: aucun Leconte Motors biedt u aan: Volvo V60 B3 Momentum Pro Geartronic Onderh"
https://www.2ememain.be/v/autos/volvo/m2317455358-volvo-v60-r-desing-inscription-polestar-model-2019,2317455358,Volvo,V60,2018.0,155000.0,Diesel,Automatique,Break,7.0,21000.0,13719.0,16737.0,23917.0,-0.2547051442910916,fair,,,,7.0,57,fr,Volvo v60 R - Desing / Inscription / polestar model 2019,EUR,Volvo V60 D4 Euro 6 temp Model 2019 155000 km oplopent Full option Als nieuw Distributieriem vervangen Juist blanco gekeurd Laatste onderhoud bij officiële volvo dealer op 155000 km Ben je volvo liefhebber dan is dit een unieke kans. Wagen is een echte eyecatcher Vraagprijs €21000 inclusief keuring Geen laagste of export toestanden,['https://images.2dehands.com/api/v1/listing-twh-p/images/94/94d382e4-1443-4460-aa62-7fd02b08fbfe?rule=ecg_mp_eps$_85'],2.0,,,,,Noir,,Roues avant,0.0,Euro 6,0.13548387096774195,"['ABS', 'Affichage tête haute', 'Aide au maintien de voie', 'Air conditionné', 'Air conditionné automatique', 'Airbags', 'Alarme', 'Android Auto', 'Anti démarrage', 'Apple Carplay', ""Assistance au freinage d'urgence"", 'Attache-remorque', 'Avertissement de sortie de voie', ""Avertisseur d'angle mort"", 'Barres de toit', 'Bluetooth', 'Caméra', 'Caméra de recul', 'Capteur de lumière', 'Capteur de pluie', 'Capteur de stationnement', 'Commande vocale', 'Conduite autonome', 'Cruise Control', 'Détection des panneaux routiers', 'Electronic Stability Program (ESP)', 'Feux de virage', 'Hayon arrière électrique', 'Interruption de démarrage', 'Intérieur cuir', 'Isofix', 'Jantes en alliage léger', 'Ordinateur de bord', 'Pack sport', 'Phares antibrouillard', 'Phares au xénon', 'Phares directionnels', 'Pilote automatique de stationnement', 'Porte coulissante', 'Radio', 'Régulateur de distance', 'Rétroviseurs extérieur chauffants', 'Rétroviseurs électriques', 'Sièges chauffants', 'Sièges sport', 'Sièges électriques', 'Système Start/Stop', 'Système de détection de la somnolence', 'Système de navigation', 'Toit ouvrant', 'Toit panoramique', 'USB', 'Verrouillage central', 'Verrouillage centralisé sans clé', 'Vitres électriques', 'Volant chauffant', 'Éclairage LED']","{'Marque & Modèle': 'Volvo V60', 'Année de fabrication': '2018', 'Kilométrage': '155.000 km', 'Carrosserie': 'Break', 'Couleur': 'Noir', 'Garniture': 'Cuir', 'Intérieur': 'Noir', 'Transmission': 'Automatique', 'Cylindrée': '2.0 liter', 'Nombre de cylindres': '4', 'Turbo': 'Non', 'Propulsion ou traction': 'Roues avant', 'Carburant': 'Diesel', 'Euronorm': 'Euro 6', 'Import voiture': 'Non', 'Entretien': 'Entretenue par le concessionnaire'}",22142.85714285714,ABS Affichage tête haute Aide au maintien de voie Air conditionné Air conditionné automatique Airbags Alarme Android Auto Anti démarrage Apple Carplay Assistance au freinage d'urgence Attache-remorque Avertissement de sortie de voie Avertisseur d'angle mort Barres de toit Bluetooth Caméra Caméra de recul Capteur de lumière Capteur de pluie Capteur de stationnement Commande vocale Conduite autonome Cruise Control Détection des panneaux routiers Electronic Stability Program (ESP) Feux de virage Hayon arrière électrique Interruption de démarrage Intérieur cuir Isofix Jantes en alliage léger Ordinateur de bord Pack sport Phares antibrouillard Phares au xénon Phares directionnels Pilote automatique de stationnement Porte coulissante Radio Régulateur de distance Rétroviseurs extérieur chauffants Rétroviseurs électriques Sièges chauffants Sièges sport Sièges électriques Système Start/Stop Système de détection de la somnolence Système de navigation Toit ouvrant Toit panoramique USB Verrouillage central Verrouillage centralisé sans clé Vitres électriques Volant chauffant Éclairage LED,Volvo V60 D4 Euro 6 temp Model 2019 155000 km oplopent Full option Als nieuw Distributieriem vervangen Juist blanco gekeurd Laatste onderhoud bij officiële volvo dealer op 155000 km Ben je volvo liefhebber dan is dit een unieke kans. Wagen is een echte eyecatcher Vraagprijs €21000 inclusief keuring Geen laagste of export toestanden
