url,ad_id,make,model,year,mileage_km,fuel,transmission,body_type,age_years,price_eur,pred_price_lo,pred_price_fair,pred_price_hi,deal_score,deal_label,seller_name,seller_rating,seller_reviews_count,images_count,options_count,language,title,currency,description,images,engine_liters,power_hp,power_kw,co2_gkm,consumption_l_100,color,doors,drivetrain_raw,turbo,euro_norm,price_per_km,options,specs_raw,km_per_year,options_text,desc_text
https://www.2ememain.be/v/autos/volvo/m2315404765-volvo-v60-2-0-d3-momentum-navi-led-pdc-av-ar,2315404765,Volvo,V60,2020.0,73947.0,Diesel,None,Break,5.0,21998.0,19381.0,23395.0,29796.0,0.05971361402008976,fair,,,,24.0,10,fr,Volvo V60 2.0 D3 Momentum Navi / Led / PDC av+ar,EUR,"Transmission: Avant Véhicule en très bon état, entièrement révisé, pas de frais ou d'entretien à prévoir.Cette Volvo vient de passer au contrôle technique, elle est prête à être livrée et... Volvo V60 2.0 D3 Momentum Navi / Led / PDC av+ar Transmission: 7 vitesses Couleur: Gris métallisé Couleur intérieure: autre Nombre de places assises: 5 Garantie: 12 mois Options et accessoires Aide à la conduite ABS Direction assistée ESP Régulateur de vitesse Système de navigation Confort Volant multifonctions Extra Détecteur de pluie Trappe à ski Verrouillage centralisé Extérieur Feux anti-brouillard Vitres électriques Sécurité Anti-démarrage Remarques Transmission: Avant Véhicule en très bon état, entièrement révisé, pas de frais ou d'entretien à prévoir. Cette Volvo vient de passer au contrôle technique, elle est prête à être livrée et immatriculée. Non-fumeur. Garantie 1 an avec possibilité d'extension 7 ans. Financement possible avec ou sans acompte. Prime de recyclage de 1000 € déjà déduite du prix de vente. Reprise possible de votre ancien véhicule au meilleur prix. Véhicule désinfecté à la livraison en présence du client. Équipements du véhicule Finition: Cuir partiel Confort: Climatisation (automatique bi-zone), Rétroviseurs électriques (rabattables, chauffants), Vitres électriques, Phares automatiques, Capteurs de pluie, Phares LED (full), Sièges électriques, Volant multifonctions, Digital Cockpit Aide à la conduite: Radars parking (avant/arrière), Régulateur de vitesse, Direction assistée Sécurité: ABS, Anti-démarrage, ESP, Capteurs de pression des pneus, Phares antibrouillard, Airbags (conducteur, passager, latéraux), Assistance au freinage d'urgence Multimédia: Système de navigation, Système audio (USB, DAB+), Bluetooth, Écran tactile Pratique: Hayon de coffre électrique, Trappe à ski, Système Isofix, Verrouillage centralisé Divers: Jantes alliage (17"") Éléments fournis avec le véhicule Attestation CAR-PASS (kilométrage certifié) Certificat de visite au contrôle technique Certificat d’immatriculation (partie 1) Certificat d’immatriculation (partie 2) Double de clé Certificat de conformité Soco Charleroi Chaussée de Bruxelles, 29 6042 Lodelinsart Numéro de téléphone: +3271326871 Numéro de fax: 32 071 315856 Adresse e-mail: lodelinsart@soco.be","['https://images.2dehands.com/api/v1/listing-twh-p/images/a3/a3739a1d-31ae-4ef9-a22f-dd92a4f38bde?rule=ecg_mp_eps$_85', 'https://images.2dehands.com/api/v1/profile-twh-p/images/44/44caf213-886d-493b-9300-8bc475419c6a?rule=ecg_mp_eps$_82', 'https://images.2dehands.com/api/v1/listing-twh-p/images/02/020310a0-3e8e-48a7-bb6b-82e94778d482?rule=ecg_mp_eps$_83', 'https://images.2dehands.com/api/v1/listing-twh-p/images/94/94e9d20f-8ee0-4afe-8123-bd27611343ba?rule=ecg_mp_eps$_83', 'https://images.2dehands.com/api/v1/listing-twh-p/images/f4/f4ac3a0d-2cba-44ee-a181-6bea368d12f4?rule=ecg_mp_eps$_83']",2.0,,,,,Argent ou Gris,,,0.0,,0.29748333265717336,"['ABS', 'Capteur de pluie', 'Cruise Control', 'Electronic Stability Program (ESP)', 'Interruption de démarrage', 'Peinture métallisée', 'Phares antibrouillard', 'Système de navigation', 'Verrouillage central', 'Vitres électriques']","{'Marque & Modèle': 'Volvo V60', 'Version': '2.0 D3 Momentum Navi / Led / PDC av+ar', 'Année de fabrication': '2020', 'Kilométrage': '73.947 km', 'Carrosserie': 'Break', 'Couleur': 'Argent ou Gris', 'Intérieur': 'Autres couleurs', 'Cylindrée': '2.0 liter', 'Nombre de cylindres': '4', 'Turbo': 'Non', 'Carburant': 'Diesel', 'Émissions de CO2': '117 g/km', 'État': 'Occasion', 'Import voiture': 'Non'}",14789.4,ABS Capteur de pluie Cruise Control Electronic Stability Program (ESP) Interruption de démarrage Peinture métallisée Phares antibrouillard Système de navigation Verrouillage central Vitres électriques,"Transmission: Avant Véhicule en très bon état, entièrement révisé, pas de frais ou d'entretien à prévoir.Cette Volvo vient de passer au contrôle technique, elle est prête à être livrée et... Volvo V60 2.0 D3 Momentum Navi / Led / PDC av+ar Transmission: 7 vitesses Couleur: Gris métallisé Couleur intérieure: autre Nombre de places assises: 5 Garantie: 12 mois Options et accessoires Aide à la conduite ABS Direction assistée ESP Régulateur de vitesse Système de navigation Confort Volant multifonctions Extra Détecteur de pluie Trappe à ski Verrouillage centralisé Extérieur Feux anti-brouillard Vitres électriques Sécurité Anti-démarrage Remarques Transmission: Avant Véhicule en très bon état, entièrement révisé, pas de frais ou d'entretien à prévoir. Cette Volvo vient de passer au contrôle technique, elle est prête à être livrée et immatriculée. Non-fumeur. Garantie 1 an avec possibilité d'extension 7 ans. Financement possible avec ou sans acompte. Prime de recyclage de 1000 € déjà déduite du prix de vente. Reprise possible de votre ancien véhicule au meilleur prix. Véhicule désinfecté à la livraison en présence du client. Équipements du véhicule Finition: Cuir partiel Confort: Climatisation (automatique bi-zone), Rétroviseurs électriques (rabattables, chauffants), Vitres électriques, Phares automatiques, Capteurs de pluie, Phares LED (full), Sièges électriques, Volant multifonctions, Digital Cockpit Aide à la conduite: Radars parking (avant/arrière), Régulateur de vitesse, Direction assistée Sécurité: ABS, Anti-démarrage, ESP, Capteurs de pression des pneus, Phares antibrouillard, Airbags (conducteur, passager, latéraux), Assistance au freinage d'urgence Multimédia: Système de navigation, Système audio (USB, DAB+), Bluetooth, Écran tactile Pratique: Hayon de coffre électrique, Trappe à ski, Système Isofix, Verrouillage centralisé Divers: Jantes alliage (17"") Éléments fournis avec le véhicule Attestation CAR-PASS (kilométrage certifié) Certificat de visite au contrôle te"
https://www.2ememain.be/v/autos/volvo/m2284727366-volvo-v60-r-design-t8-awd-hybride-camera-pano-dak,2284727366,Volvo,V60 R-Design T8 AWD Hybride | Camera | Pano dak | Adapt Cruise,2022.0,119499.0,Essence,Automatique,Break,3.0,39750.0,19778.0,28519.0,31922.0,-0.3938076370139205,overpriced,,,,22.0,10,fr,Volvo V60 R-Design T8 AWD Hybride | Camera | Pano dak |,EUR,"Luxury Seat Pack Elektrisch bediende passagierszetel Geheugenfunctie voor de zitpositie van de passagierszetel vooraan Business Pack 2 Verwarmbare voorzetels Driver Assistance: Adaptive Cruise Control + Pilot Assist * Panoramisch schuif- en kanteldak met elek. bediend zonnegordijn Donkergetinte achterruiten Zonder model en motor emblemen Geïntegreerde dubbele uitlaten links en rechts Bekleding van geventileerd nappaleer Geventileerde voorzetels Elektrisch verstelbare zijsteunen voor beide voorzetels Comfortzetels vooraan 8-traps Geartronic™-automaat Aluminium sportpedalen R-Design schakelpookknop in leder Klimaatregeling: 2 temperatuurzones en ventilatieroosters achter Uitschakelbare passagiersairbag vooraan Bestuurder - en passagiers airbag Panoramisch schuif- en kanteldak met elek. bediend zonnegordijn Charcoal dakhemelbekleding Road Sign Information Lane Keeping Aid met Run-off Road Mitigation R-Design radiatorrooster met omlijsting en lamellen Glossy Black Full LED koplampen met Active High Beam Hogedruk koplampreinigingsinstallatie 12 inch bestuurdersdisplay Adaptive Cruise Control Snelheidsbegrenzer Volvo on Call app Geventileerde subwoofer DAB+ (Digital Audio Broadcasting) High Performance audiosysteem 330W met 10 luidsprekers Elektrisch inklapbare buitenspiegels Geheugenfunctie voor de zitpositie van de passagierszetel vooraan Automatische deurvergrendeling Transpondersleutel Buitenspiegelkappen in contrastkleur Solid Black Double Locking Donkergetinte achterruiten Elektrisch bediende kofferklep Keyless Entry met handenvrije opening/sluiting van de kofferklep Clean Zone: interieurluchtkwaliteitssysteem met IAQS en koolstoffilter Stembediening voor het Sensus Connect systeem Digitale gebruikershandleiding Sierpaneel van Metal Mesh aluminium Elektrisch bediende bestuurderszetel met geheugenfunctie Elektrisch bediende passagierszetel Verwarmbare voorzetels Elektrisch bediende buitenste hoofdsteunen achterin Vijfzitsconfiguratie Achterbank met neerklapbare rugleuning in twee delen 60/40 Lendensteun vooraan elektrisch regelbaar in 4 richtingen Sport vloermatten voor- en achteraan Nylon veiligheidsnet tussen achterbank en bagageruimte Opvouwbare laadvloer/laadruimteverdeler met boodschappentashouders Centrale armsteun achteraan met bekerhouders en doorsteekluik Verlichte make-upspiegels Interieurverlichting Pro 12V stopcontact in de bagageruimte Vier inklapbare verankeringsogen in de bagageruimte Rolhoes. handbediend/halfautomatisch Buiten- en binnenspiegels met automatische dimfunctie Verborgen opbergruimte Voorzetels met elektrisch verlengbaar zitkussen Chassis Hill Start Assist Bandenspanningscontrolesysteem iTPMS Oncoming Lane Mitigation Noodremlichten Verwarmbaar stuurwiel Simili-leder sportstuur met stiksel. Glossy Black bedieningsknop. Instelbare stuurbekrachtiging 18"" met 5 dubbele spaken. Matt Black/Diamond Cut (1039) Bandenreparatiekit Twee geïntegreerde uitlaten Wisserbladen met geïntegreerde sproeiers. voor en achter Aluminium laaddrempelbeschermer Glossy Black zijruitomlijsting Glossy Black geïntegreerde dakrails Zonder model en motor emblemen Zonder motorembleem Tempered glass. side & rear windows Sensus navigatiesysteem incl. RTTI + gratis kaartupdates Park Assist parkeerhulp vooraan Tickethouder Hoogspanningskoeler/-verwarmer (HVCH) Park Assist Camera achteraan Brandblushouder Wieldoppenset. Matt Tech Grey Smartphone integratie 9"" middendisplay Laadkabel 1-fase 10A mode 2. Schuko stekker (thuisgebruik) (7m) Whiplashbescherming. voorzetels Gordijnairbags Side Impact Protection System ISOFIX bevestigingspunten: buitenste zitplaatsen achteraan Veiligheidsgordels Regensensor Stuurwielbediening Vochtigheidssensor Start/Stopsysteem Bluetooth® voor handenvrij bellen en muziekstreaming","['https://images.2dehands.com/api/v1/listing-twh-p/images/4e/4e35bf03-8414-4ce9-8d4f-d640ba534efa?rule=ecg_mp_eps$_85', 'https://images.2dehands.com/api/v1/listing-twh-p/images/d7/d72b4a7a-915f-48d7-b83c-07b3802fd156?rule=ecg_mp_eps$_83', 'https://images.2dehands.com/api/v1/listing-twh-p/images/f8/f8d37aa4-c662-4b1a-9dc0-1d26943ed871?rule=ecg_mp_eps$_83', 'https://images.2dehands.com/api/v1/listing-twh-p/images/a3/a322d670-59cf-4724-8f61-ea9575bbba1a?rule=ecg_mp_eps$_83']",2.0,,,,,Noir,,,0.0,Euro 6,0.3326387668516054,"['4x4', 'Air conditionné', 'Airbags', 'Bluetooth', 'Capteur de stationnement', 'Cruise Control', 'Isofix', 'Pilote automatique de stationnement', 'Rétroviseurs électriques', 'Système de navigation']","{'Marque & Modèle': 'Volvo V60 R-Design T8 AWD Hybride | Camera | Pano dak | Adapt Cruise', 'Année de fabrication': '2022', 'Kilométrage': '119.499 km', 'Carrosserie': 'Break', 'Couleur': 'Noir', 'Transmission': 'Automatique', 'Cylindrée': '2.0 liter', 'Turbo': 'Non', 'Carburant': 'Essence', 'Émissions de CO2': '18 g/km', 'Euronorm': 'Euro 6', 'Import voiture': 'Non'}",39833.0,4x4 Air conditionné Airbags Bluetooth Capteur de stationnement Cruise Control Isofix Pilote automatique de stationnement Rétroviseurs électriques Système de navigation,Luxury Seat Pack Elektrisch bediende passagierszetel Geheugenfunctie voor de zitpositie van de passagierszetel vooraan Business Pack 2 Verwarmbare voorzetels Driver Assistance: Adaptive Cruise Control + Pilot Assist * Panoramisch schuif- en kanteldak met elek. bediend zonnegordijn Donkergetinte achterruiten Zonder model en motor emblemen Geïntegreerde dubbele uitlaten links en rechts Bekleding van geventileerd nappaleer Geventileerde voorzetels Elektrisch verstelbare zijsteunen voor beide voorzetels Comfortzetels vooraan 8-traps Geartronic™-automaat Aluminium sportpedalen R-Design schakelpookknop in leder Klimaatregeling: 2 temperatuurzones en ventilatieroosters achter Uitschakelbare passagiersairbag vooraan Bestuurder - en passagiers airbag Panoramisch schuif- en kanteldak met elek. bediend zonnegordijn Charcoal dakhemelbekleding Road Sign Information Lane Keeping Aid met Run-off Road Mitigation R-Design radiatorrooster met omlijsting en lamellen Glossy Black Full LED koplampen met Active High Beam Hogedruk koplampreinigingsinstallatie 12 inch bestuurdersdisplay Adaptive Cruise Control Snelheidsbegrenzer Volvo on Call app Geventileerde subwoofer DAB+ (Digital Audio Broadcasting) High Performance audiosysteem 330W met 10 luidsprekers Elektrisch inklapbare buitenspiegels Geheugenfunctie voor de zitpositie van de passagierszetel vooraan Automatische deurvergrendeling Transpondersleutel Buitenspiegelkappen in contrastkleur Solid Black Double Locking Donkergetinte achterruiten Elektrisch bediende kofferklep Keyless Entry met handenvrije opening/sluiting van de kofferklep Clean Zone: interieurluchtkwaliteitssysteem met IAQS en koolstoffilter Stembediening voor het Sensus Connect systeem Digitale gebruikershandleiding Sierpaneel van Metal Mesh aluminium Elektrisch bediende bestuurderszetel met geheugenfunctie Elektrisch bediende passagierszetel Verwarmbare voorzetels Elektrisch bediende buitenste hoofdsteunen achterin Vijfzitsconfiguratie Achterbank met neerklapbare rugle
https://www.2ememain.be/v/autos/volvo/m2315347329-volvo-v60-t6-recharge-ultra-dark-pano-dak,2315347329,Volvo,V60 T6 Recharge Ultra Dark + PANO DAK,2024.0,9618.0,Essence,Automatique,Break,1.0,46900.0,19272.0,43613.0,46719.0,-0.07536743631486024,fair,,,,12.0,8,fr,Volvo V60 T6 Recharge Ultra Dark + PANO DAK,EUR,"Schakelpookknop in simili-leder bekleed Hemelbekleding in Blond Metal Mesh aluminium sierinleg Leerbekleding Stuurwiel op maat. Charcoal Comfort-voorstoelen 8-traps Geartronic™-automaat Pedalen Aircosysteem met twee zones Naloop parkeerklimaat Passagiersairbagschakelaar Tweetrapsairbags Panoramisch dak Road Sign Information Lane Keeping Aid en Lane Departure Warning Frontgrille met hoogglans zwart inzetstuk Verwarmd grille-embleem Full LED koplampen met Active High Beam Hogedruk koplampreinigingsinstallatie Controle aanhangerverlichting 12.3"" bestuurdersdisplay Google Services Adaptive Cruise Control Grafisch Head-up Display Pilot Assist Intelligent Speed Assist (ISA) Volvo Cars-app Geventileerde subwoofer Digital Audio Broadcasting (DAB+) Harman Kardon Premium Sound Elektrisch inklapbare buitenspiegels Geheugenfunctie voor de zitpositie van de passagierszetel vooraan Automatische portiervergrendeling Transpondersleutel Spiegelkappen in glanzend zwart Dubbele vergrendeling Donkergetinte achterruiten Driver Awareness: BLIS™ and Cross Traffic Alert Volvo Guard alarmsysteem Elektrisch bedienbare kindersloten op achterportieren Elektrisch bediende achterklep Keyless Entry met handsfree elektrische achterklep. Luchtfilter en interieurvoorreiniging op afstand Digitale gebruikershandleiding Taal Nederlands (België) Instructieboekje met garantieboekje in het Nederlands (België) Op het interieur afgestemd dashboard Elektrisch bedienbare bestuurderszetel met geheugen Elektrisch bedienbare passagiersstoel Verwarmbare voorzetels Verwarmbare buitenste zitplaatsen tweede zitrij Elektrisch neerklapbare hoofdsteunen achteraan 5 zitplaatsen Mechanische ontgrendeling van de tweede rij zitplaatsen Elektrisch bedienbare lendensteun met 4-wegverstelling Textielen vloermatten voor het interieur Bagagenet Boodschappentashouder Middenarmsteun achter Verlichte make-upspiegels Geavanceerde interieurverlichting Elektrische aansluiting. bagageruimte Verankeringsogen voor de bagage EHBO-set Rolhoes. handbediend/halfautomatisch Buiten- en binnenspiegels met automatische dimfunctie Verborgen opbergruimte Verstelbare zittingverlenging voor Chassis Hill Start Assist Tyre Pressure Monitoring System Oncoming Lane Mitigation Rear Collision Warning Waarschuwing voor glad wegdek Noodstopverlichting Verwarmbaar stuurwiel Adaptieve stuurbekrachtiging 18-inch 5 dubbele spaken Glossy Black/Diam. Cut Noodreparatieset Wisserbladen met geïntegreerde sproeiers. voor en achter Op de carrosseriekleur afgestemde portiergrepen met grondverlichting Scuff plate achterklepopening. roestvrij staal Volvo instaplijsten. aluminium Glossy Black omlijsting zijruit Dakrails. Glossy Black Gevarendriehoek Getemperde zijruiten Park Assist parkeerhulp vooraan en achteraan Houder voor parkeerkaartjes Elektrisch verwarmen en koelen van uw interieur Park Assist Camera achteraan Software voor alcoholslot Houder voor brandblusser Wieldoppenset. Matt Tech Grey Apple CarPlay 9 inch middendisplay Laadkabel 3-fase 16A mode 3. Mennekes contactstekker (voor laadpaal) (7m) (vervangt standaard laadkabel) Bescherming tegen whiplash Gordijnairbag Zijdelingse bescherming Intelligent Driver Information System (IDIS) Hooggeplaatste remlichten achter ISOFIX bevestigingspunten. achterbank Veiligheidsgordels Regensensor Bedieningsknoppen op het stuur Vochtigheidssensor Start/Stopsysteem Bluetooth®-verbinding",['https://images.2dehands.com/api/v1/listing-twh-p/images/69/69c7a5f5-3f27-4584-b7c4-7085b50571a3?rule=ecg_mp_eps$_85'],2.0,,,,,Argent ou Gris,,,0.0,,4.87627365356623,"['4x4', 'Airbags', 'Alarme', 'Capteur de stationnement', 'Cruise Control', 'Isofix', 'Pilote automatique de stationnement', 'Rétroviseurs électriques']","{'Marque & Modèle': 'Volvo V60 T6 Recharge Ultra Dark + PANO DAK', 'Année de fabrication': '2024', 'Kilométrage': '9.618 km', 'Carrosserie': 'Break', 'Couleur': 'Argent ou Gris', 'Transmission': 'Automatique', 'Cylindrée': '2.0 liter', 'Turbo': 'Non', 'Carburant': 'Essence', 'Import voiture': 'Non'}",9618.0,4x4 Airbags Alarme Capteur de stationnement Cruise Control Isofix Pilote automatique de stationnement Rétroviseurs électriques,"Schakelpookknop in simili-leder bekleed Hemelbekleding in Blond Metal Mesh aluminium sierinleg Leerbekleding Stuurwiel op maat. Charcoal Comfort-voorstoelen 8-traps Geartronic™-automaat Pedalen Aircosysteem met twee zones Naloop parkeerklimaat Passagiersairbagschakelaar Tweetrapsairbags Panoramisch dak Road Sign Information Lane Keeping Aid en Lane Departure Warning Frontgrille met hoogglans zwart inzetstuk Verwarmd grille-embleem Full LED koplampen met Active High Beam Hogedruk koplampreinigingsinstallatie Controle aanhangerverlichting 12.3"" bestuurdersdisplay Google Services Adaptive Cruise Control Grafisch Head-up Display Pilot Assist Intelligent Speed Assist (ISA) Volvo Cars-app Geventileerde subwoofer Digital Audio Broadcasting (DAB+) Harman Kardon Premium Sound Elektrisch inklapbare buitenspiegels Geheugenfunctie voor de zitpositie van de passagierszetel vooraan Automatische portiervergrendeling Transpondersleutel Spiegelkappen in glanzend zwart Dubbele vergrendeling Donkergetinte achterruiten Driver Awareness: BLIS™ and Cross Traffic Alert Volvo Guard alarmsysteem Elektrisch bedienbare kindersloten op achterportieren Elektrisch bediende achterklep Keyless Entry met handsfree elektrische achterklep. Luchtfilter en interieurvoorreiniging op afstand Digitale gebruikershandleiding Taal Nederlands (België) Instructieboekje met garantieboekje in het Nederlands (België) Op het interieur afgestemd dashboard Elektrisch bedienbare bestuurderszetel met geheugen Elektrisch bedienbare passagiersstoel Verwarmbare voorzetels Verwarmbare buitenste zitplaatsen tweede zitrij Elektrisch neerklapbare hoofdsteunen achteraan 5 zitplaatsen Mechanische ontgrendeling van de tweede rij zitplaatsen Elektrisch bedienbare lendensteun met 4-wegverstelling Textielen vloermatten voor het interieur Bagagenet Boodschappentashouder Middenarmsteun achter Verlichte make-upspiegels Geavanceerde interieurverlichting Elektrische aansluiting. bagageruimte Verankeringsogen voor de bagage EHBO-set Rol"
https://www.2ememain.be/v/autos/volvo/m2315329777-volvo-v60-2-0-diesel-autom-ocean-race-airco-topstaat,2315329777,Volvo,V60,2015.0,173146.0,Diesel,Automatique,Break,10.0,10990.0,7402.0,10254.0,24780.0,-0.07177686756387751,fair,,,,27.0,19,fr,Volvo V60 2.0 Diesel Autom. - Ocean Race - Airco - Topstaat!,EUR,"www.provanmotors.be voor meer info. Prachtige Volvo V60 2.0d te koop van EERSTE EIGENAAR! Wagen verkeert in TOPSTAAT! GPS - Automatische Airco - Alu Velgen 18 - Cruise Control - Bluetooth - Multifunctiestuur - Radio + USB - Licht- & Regensensor - Elektrische Ramen + Zijspiegels - Parkeersensoren AR - Getinte Ruiten - Boordcomputer - Start/Stop,... Car-Pass aanwezig. Contactopname regio Gent : 0032(0) 498 52 72 24 op 100m van de MAKRO!","['https://images.2dehands.com/api/v1/listing-twh-p/images/46/46b134f4-2fc0-419b-b15c-4fcbc3e81c46?rule=ecg_mp_eps$_85', 'https://images.2dehands.com/api/v1/listing-twh-p/images/58/58fbd91f-33ec-40ad-9df1-265cffd91dff?rule=ecg_mp_eps$_83', 'https://images.2dehands.com/api/v1/listing-twh-p/images/80/802d5f39-bd1b-4ede-9a2f-7e162706f1c2?rule=ecg_mp_eps$_83', 'https://images.2dehands.com/api/v1/listing-twh-p/images/34/34a6fd65-f57f-40f6-b9c5-c6a237a88b75?rule=ecg_mp_eps$_83']",2.0,,,,,Noir,,,0.0,Euro 6,0.06347244521964122,"['Air conditionné', 'Air conditionné automatique', 'Airbags', 'Bluetooth', 'Capteur de lumière', 'Capteur de pluie', 'Capteur de stationnement', 'Commande vocale', 'Cruise Control', 'Intérieur cuir', 'Isofix', 'Jantes en alliage léger', 'Ordinateur de bord', 'Radio', 'Rétroviseurs électriques', 'Système de navigation', 'Toit ouvrant', 'Verrouillage central', 'Vitres électriques']","{'Marque & Modèle': 'Volvo V60', 'Version': '2.0 Diesel Autom. - Ocean Race - Airco - Topstaat!', 'Année de fabrication': '2015', 'Kilométrage': '173.146 km', 'Carrosserie': 'Break', 'Couleur': 'Noir', 'Intérieur': 'Noir', 'Transmission': 'Automatique', 'Cylindrée': '2.0 liter', 'Nombre de cylindres': '4', 'Turbo': 'Non', 'Carburant': 'Diesel', 'Émissions de CO2': '112 g/km', 'Euronorm': 'Euro 6', 'Import voiture': 'Non'}",17314.6,Air conditionné Air conditionné automatique Airbags Bluetooth Capteur de lumière Capteur de pluie Capteur de stationnement Commande vocale Cruise Control Intérieur cuir Isofix Jantes en alliage léger Ordinateur de bord Radio Rétroviseurs électriques Système de navigation Toit ouvrant Verrouillage central Vitres électriques,"www.provanmotors.be voor meer info. Prachtige Volvo V60 2.0d te koop van EERSTE EIGENAAR! Wagen verkeert in TOPSTAAT! GPS - Automatische Airco - Alu Velgen 18 - Cruise Control - Bluetooth - Multifunctiestuur - Radio + USB - Licht- & Regensensor - Elektrische Ramen + Zijspiegels - Parkeersensoren AR - Getinte Ruiten - Boordcomputer - Start/Stop,... Car-Pass aanwezig. Contactopname regio Gent : 0032(0) 498 52 72 24 op 100m van de MAKRO!"
