url,ad_id,language,title,price_eur,currency,seller_name,seller_rating,seller_reviews_count,description,images_count,images,make,model,year,mileage_km,fuel,transmission,engine_liters,power_hp,power_kw,co2_gkm,consumption_l_100,body_type,color,doors,drivetrain_raw,turbo,euro_norm,age_years,price_per_km,options_count,options,specs_raw
https://www.2ememain.be/v/autos/saab/m2353715929-saab-9-3-2-0t-cabrio-aero-bj02-08-154-kw-209-ch-191-000-ch,2353715929,fr,"Saab 9-3 2.0T Cabrio Aero,bj02.08, 154 kW/209 ch, 191 000 ch",13500,EUR,,,,"Ce magnifique cabriolet Saab 9-3 2.0T Aero Vector a toujours été parfaitement entretenu chez le concessionnaire Saab officiel Deboo à Bruges. Il présente de légères traces d'usure et un moteur puissant de 210 ch. Dernière révision effectuée le 20 avril 2025 au garage Saab Deboo : vidange, remplacement des filtres à huile, à air et d'habitacle, recharge de la climatisation, pneus toutes saisons en excellent état. Aucune trace de rouille ni défaut. La capote est impeccable, sans aucun dommage, déchirure ni tache. Ce cabriolet vous accompagnera pendant de nombreuses années. N'hésitez plus, réalisez votre rêve !",1,https://images.2dehands.com/api/v1/listing-twh-p/images/c6/c6a515b5-7d45-464f-8114-cc1dbda6f5ca?rule=ecg_mp_eps$_85,Saab,9-3 2.0T Cabrio,2025,,,,,,,,,,,,,,,1,,0,,{}
https://www.2ememain.be/v/autos/saab/m2353676581-saab-93-2-0i-130-ch-essence-full-options-5-portes,2353676581,fr,Saab 93 2.0i 130 Ch Essence Full Options 5 Portes,2495,EUR,,,,"🚗 Saab 9-3 2.0i 130 Ch Essence Full Option – Excellent état, fiable et confortable 📅 Année : 03 / 2000 ⏱️ Kilométrage : 170.000 Km ⚙️ Motorisation : 2.0i essence 130 Ch 🕹️ Boîte de vitesses : manuelle 5 Vitesses 🚘 Carrosserie : 5 portes 🎨 Couleur : Vert foncé métallisé Intérieur en Full Cuir Beige 🔎 Description du véhicule : À vendre Saab 9-3 2.0i en très bon état général, aussi bien à l’extérieur qu’à l’intérieur. Voiture propre, bien entretenue et toujours conduite avec soin. La carrosserie est brillante, sans gros défaut, et l’habitacle est en très bon état. La Saab 9-3 est connue pour sa robustesse, sa sécurité et son confort typiquement suédois. Idéale comme voiture principale ou seconde voiture fiable et économique. --- ⚙️ Équipements et options : Climatisation Direction assistée 4 Vitres électriques Fermeture centralisée Autoradio CD Attelage de remorque Sièges confortables en Cuir --- 🧰 Entretien et état mécanique : Vidange et filtres récents Pneus en bon état Freins vérifiés Aucun voyant au tableau de bord 💰 Prix : 2495€ 📍 Localisation : Zaventem 📞 Contact : Appels Uniquement !!! ☎️ 0️⃣4️⃣9️⃣4️⃣ 7️⃣5️⃣ 0️⃣4️⃣ 6️⃣4️⃣",1,https://images.2dehands.com/api/v1/listing-twh-p/images/60/60ccacff-4516-46bd-a339-68bfb59e88bf?rule=ecg_mp_eps$_85,Saab,93 2.0i 130,2000,170000,Essence,Manual,,,,,,,,,,,,26,0.014676,0,,{}
https://www.2ememain.be/v/autos/saab/m2352882272-saab-9-3-cabriolet-1-9-tid-16v-bj-2006-198000km,2352882272,fr,Saab 9-3 Cabriolet 1.9 TiD 16v bj. 2006 198000km,3450,EUR,,,,"SAAB 9.3 cabriolet 2.0 bj. 2006 met 199000km. Euro 4. Handelaarsprijs/Meeneemprijs: 3950 € Prijs particulier: 4950 € inclusief: - Keuring voor verkoop ( 80 puntencontrole ) - Car-Pass (... Saab 9-3 Cabriolet 1.9 TiD 16v bj. 2006 198000km Transmission: 6 vitesses, Commande manuelle Couleur: Noir métallisé Couleur intérieure: noir Nombre de places assises: 4 TVA/marge: TVA non déductible (régime de la marge bénéficiaire) Options et accessoires Airbag chauffeur Airbag passager Airbags latéraux Climate control ESP Fenêtres électriques ISOFIX Livrets d'entretien présents Ordinateur de bord Radio/Lecteur CD Roues en métal léger Réglage antidérapant Rétroviseurs extérieurs à réglage électrique Sièges sport Starter Support bras intermédiaire Système antiblocage Verre teinté Verrouillage centralisé des portes Verrouillage centralisé à distance Volant cuir Volant multifunction Véhicule non-fumeur Remarques SAAB 9.3 cabriolet 2.0 bj. 2006 met 199000km. Euro 4. Handelaarsprijs/Meeneemprijs: 3950 € Prijs particulier: 4950 € inclusief: - Keuring voor verkoop ( 80 puntencontrole ) - Car-Pass ( kilometercertificaat ) - Onderhoudsbeurt voor aflevering auto - Professionele dieptereiniging interieur - 12 maanden garantie Tel. 0493.93.83.83 Auto Denys Dijkstraat 22 9160 Lokeren Numéro de téléphone: 0032 493 93 83 83 Adresse e-mail: autodenys@gmail.com",1,https://images.2dehands.com/api/v1/listing-twh-p/images/c0/c0fac92e-a2ac-4485-a4e5-fcab9f356a72?rule=ecg_mp_eps$_85,Saab,9-3 Cabriolet 1.9,2006,198000,Electric,Manual,,,,,,,,,,,,20,0.017424,0,,{}
https://www.2ememain.be/v/autos/saab/m2333143790-saab-9-3-1800-turbo-2007-vector-3995-a-saisir,2333143790,fr,SAAB 9-3 1800 TURBO 2007 VECTOR 3995 A SAISIR !!!!,3995,EUR,,,,"Superbe SAAB 9-3 VECTOR 1800 TURBO pour puristes , le mailleur Prix justifié . Tableau de bord face lifift avec arrière du modèle 2008 , face avant 2007 pour les SAABISTES . Entretenue , suivie et propre !!! PRIX JUSTIFIé !!! 3995 TTC ( LIMITE CADEAU ) !!!",1,https://images.2dehands.com/api/v1/listing-twh-p/images/2b/2b408e9a-07f2-40bf-8d5e-fa9415ffe5f8?rule=ecg_mp_eps$_85,Saab,9-3 1800 TURBO,2007,,,,,,,,,,,,,,,19,,0,,{}
https://www.2ememain.be/v/autos/saab/m2333011463-saab-9-3-2-0-essence-automatique-2006-110kw,2333011463,fr,Saab 9-3 2.0 Essence Automatique 2006 110kw,2900,EUR,,,,Saab 9-3 2.0 Essence 2006 110kw 150ch euro 4. 175.154km Bonne mécanique et roule très bien prix export ou marchand !!!!!! Pour plus d’informations contactez le numéro de téléphone ou WhatsApp +32 497 30 30 03,2,https://images.2dehands.com/api/v1/listing-twh-p/images/0e/0ef07881-6bbc-4aa7-9e35-113d5586e62a?rule=ecg_mp_eps$_85|https://images.2dehands.com/api/v1/profile-twh-p/images/1d/1d8417e9-b078-42ad-bc13-1b292f29ab73?rule=ecg_mp_eps$_82,Saab,9-3 2.0 Essence,2006,175154,Essence,Automatic,,,,,,,,,,,,20,0.016557,0,,{}
https://www.2ememain.be/v/autos/saab/m2345689342-saab-9-3-2-0t,2345689342,fr,Saab 9-3 2.0t,2800,EUR,,,,"Te koop: Saab 9-3 2.0t Automaat – betrouwbare en karaktervolle Zweedse turbo-benzine! Kilometerstand: 203.000 km Motor: 2.0 liter turbobenzine Vermogen: ± 185 pk – sportieve maar bruikbare power Transmissie: Automatische versnellingsbak Voorwielaandrijving – comfortabel en probleemloos rijden Bouwjaar: 2003 🚪 Aantal deuren: 5 / Sedan ⸻ Waarom deze Saab 9-3 een slimme keuze is Klassiek en tijdloos design De Saab 9-3 heeft een karaktervolle look die nog altijd opvalt in het verkeer – subtiel sportief en elegant tegelijk. ✔️ Comfortabel en volwassen weggedrag De auto rijdt vooral comfortabel op de baan en is ideaal als dagelijkse wagen, lange ritten of zelfs voor weekendtrips. ✔️ Turbo-motor met karakter De 2.0 t turbo-motor levert voldoende vermogen voor vlotte acceleraties en blijft betrouwbaar bij normaal gebruik. Saab-motoren staan bekend om hun turbokracht bij relatief lage toerentallen. ✔️ Praktisch en ruim Met een ruime kofferbak en comfortabele zitplaatsen voor vijf personen is dit een auto die altijd meer kan dan alleen pendelen.",1,https://images.2dehands.com/api/v1/listing-twh-p/images/2f/2f493de2-f9fe-4a0e-948a-2d0fdbab14a4?rule=ecg_mp_eps$_85,Saab,9-3 2.0t,2003,203000,Benzin,Automatic,,,,,,,,,,,,23,0.013793,0,,{}
https://www.2ememain.be/v/autos/saab/m1941164334-saab-cabr-1er-prop-uk-rhd-full-service-hist-2495,1941164334,fr,Saab Cabr 1er Prop. UK !! RHD !!! full service hist. 2495€,2495,EUR,,,,"Saab Cabriolet 1er Propriétaire. Royaume-Uni RHD !! Voiture initialement achetée pour pièces, l'état est beaucoup trop bon pour être démonté. C'est un prix à emporter, pas de contrôle, pas de garantie ! Le prix est également FIXE.",2,https://images.2dehands.com/api/v1/listing-twh-p/images/39/393cd987-7a66-454c-a666-fef73280e180?rule=ecg_mp_eps$_85|https://images.2dehands.com/api/v1/profile-twh-p/images/44/442b7d99-25f5-415a-890a-50e16f39965a?rule=ecg_mp_eps$_82,Saab,Cabr 1er Prop.,,,,,,,,,,,,,,,,,,0,,{}
https://www.2ememain.be/v/autos/saab/m2351802834-saab-93-2-0i-130-ch-essence-full-options-5-portes,2351802834,fr,Saab 93 2.0i 130 Ch Essence Full Options 5 Portes,2495,EUR,,,,"🚗 Saab 9-3 2.0i 130 Ch Essence Full Option – Excellent état, fiable et confortable 📅 Année : 03 / 2000 ⏱️ Kilométrage : 170.000 Km ⚙️ Motorisation : 2.0i essence 130 Ch 🕹️ Boîte de vitesses : manuelle 5 Vitesses 🚘 Carrosserie : 5 portes 🎨 Couleur : Vert foncé métallisé Intérieur en Full Cuir Beige 🔎 Description du véhicule : À vendre Saab 9-3 2.0i en très bon état général, aussi bien à l’extérieur qu’à l’intérieur. Voiture propre, bien entretenue et toujours conduite avec soin. La carrosserie est brillante, sans gros défaut, et l’habitacle est en très bon état. La Saab 9-3 est connue pour sa robustesse, sa sécurité et son confort typiquement suédois. Idéale comme voiture principale ou seconde voiture fiable et économique. --- ⚙️ Équipements et options : Climatisation Direction assistée 4 Vitres électriques Fermeture centralisée Autoradio CD Attelage de remorque Sièges confortables en Cuir --- 🧰 Entretien et état mécanique : Vidange et filtres récents Pneus en bon état Freins vérifiés Aucun voyant au tableau de bord 💰 Prix : 2495€ 📍 Localisation : Zaventem 📞 Contact : Appels Uniquement !!! ☎️ 0️⃣4️⃣9️⃣4️⃣ 7️⃣5️⃣ 0️⃣4️⃣ 6️⃣4️⃣",1,https://images.2dehands.com/api/v1/listing-twh-p/images/49/49f28a85-58f4-4e67-b6c1-1378d6ab5ae2?rule=ecg_mp_eps$_85,Saab,93 2.0i 130,2000,170000,Essence,Manual,,,,,,,,,,,,26,0.014676,0,,{}
https://www.2ememain.be/v/autos/saab/m2331341178-saab-9-3-cabrio-aero-2-8-v6-en-parfait-etat,2331341178,fr,Saab 9-3 Cabrio Aero 2.8 V6 en parfait état !,6500,EUR,,,,"Très bonne voiture puissante qui roule parfaitement malgré les kilomètres ! La voiture est toujours très élégante, tout fonctionne parfaitement, le moteur est vraiment en très bon état... et la voiture possède déjà une boîte manuelle à 6 rapports ! Équipé de pratiquement toutes les options telles que : Navigation - commande électrique des sièges - sièges chauffants - climatisation - régulateur de vitesse - 6 vitesses - phares au xénon - capteur de pluie - capot électrique - rétroviseurs électriques - ordinateur de bord - capteurs de stationnement - commandes au volant - commande vocale, etc... C'est un objet de collection dont la valeur ne fera qu'augmenter ! Venez voir, faites un essai routier et voyez par vous-même ! prix à emporter : 6500€ Contrôle technique/inspection avant vente : 7500€ Inspection + 1 an de garantie : 8500€",3,https://images.2dehands.com/api/v1/listing-twh-p/images/67/67efc83d-e7e4-47ff-95bf-ca465b875131?rule=ecg_mp_eps$_85|https://images.2dehands.com/api/v1/listing-twh-p/images/62/628dba40-468a-4606-93a3-6cda350d7210?rule=ecg_mp_eps$_83|https://images.2dehands.com/api/v1/listing-twh-p/images/28/282c0a9f-addf-441a-9f0e-5c689ad02a5c?rule=ecg_mp_eps$_83,Saab,9-3 Cabrio Aero,,,Electric,Manual,,,,,,,,,,,,,,0,,{}
https://www.2ememain.be/v/autos/saab/m2350677023-saab-9-3-1-9-tid-bj-2007-179000km,2350677023,fr,Saab 9-3 1.9 Tid bj. 2007 179000km,1950,EUR,,,,"Saab 9-3 1.9 Tid bj. 2007 179000km Transmission: 6 vitesses, Commande manuelle Couleur: Gris métallisé Nombre de places assises: 5 TVA/marge: TVA non déductible (régime de la marge bénéficiaire) Options et accessoires Airbag chauffeur Airbag passager Airbags arrière Airbags de tête Airbags latéraux Air conditionné Antibrouillards avant Banquette arrière rabattable (parties inégales) Climate control ESP Fenêtres électriques Feux de croisement automatiques ISOFIX Livrets d'entretien présents Radio/Lecteur CD Radio avec lecteur MP3 Roues en métal léger Réglage antidérapant Rétroviseurs extérieurs à réglage électrique Sièges sport Starter Support bras intermédiaire Système antiblocage Système d'alarme Verre teinté Verrouillage centralisé des portes Verrouillage centralisé à distance Volant cuir Volant multifunction Véhicule non-fumeur Auto Denys Dijkstraat 22 9160 Lokeren Numéro de téléphone: 0032 493 93 83 83 Adresse e-mail: autodenys@gmail.com",1,https://images.2dehands.com/api/v1/listing-twh-p/images/e8/e8beb0df-a5a3-4539-ad3d-d162be87028c?rule=ecg_mp_eps$_85,Saab,9-3 1.9 Tid,2007,179000,Electric,Automatic,,,,,,,,,,,,19,0.010894,0,,{}
https://www.2ememain.be/v/autos/saab/m2350360246-saab-9-3-cabrio-aero-2-8-v6-manueel-benzine,2350360246,fr,Saab 9.3 Cabrio Aero 2.8 - V6 - manueel/benzine,19500,EUR,,,,"Deze Saab 9-3 Cabriolet Aero 2.8 uit 2006 is een stijlvolle, prestatiegerichte cabrio met een krachtige 2.8L V6 turbo motor en 250 pk. De wagen wordt jaarlijks onderhouden bij een Saab-specialist in Eersel (NL). Om de uitstraling van de wagen te maximaliseren werd de laatste jaren daarnaast o.a. de voorruit en de bekleding van de voorste raamstijlen vervangen, achterbumper + kofferdeksel herspoten, 4 remklauwen gelakt en een afneembare trekhaak gemonteerd.",1,https://images.2dehands.com/api/v1/listing-twh-p/images/4f/4f2f48db-a681-48af-a6ce-bca0462706b2?rule=ecg_mp_eps$_85,Saab,9.3 Cabrio Aero,2006,,Benzin,,,,,,,,,,,,,20,,0,,{}
https://www.2ememain.be/v/autos/saab/m2350116138-superbe-rare-saab-9-3-turbo-hirsch-veritable,2350116138,fr,Superbe & Rare Saab 9-3 Turbo HIRSCH véritable,4950,EUR,,,,"Saab 9-3 2.0 Turbo – Véritable Hirsch certifiée – État sain Saab 9-3 2.0 Turbo en véritable version Hirsch Performance, avec certificat officiel et historique complet (avec classeur complet). Voiture saine, entretenue, qui roule parfaitement, sans bruit ni souci. Allumage neuf (bobines neuves spécifiques NGK) et entretien suivi. Très agréable à conduire, moteur performant et fiable, consommation raisonnable pour la puissance. Faibles taxes. Équipements : GPS, Bluetooth, son Bose, Apple CarPlay, jantes 17”, intérieur cuir, sièges chauffants, clim bi-zone, cruise control, commandes au volant, etc. Prête à rouler, idéale pour amateur de Saab recherchant une version rare et authentique. À venir voir et essayer.",1,https://images.2dehands.com/api/v1/listing-twh-p/images/97/97d80984-1329-42e2-80c8-896b8cde2c6f?rule=ecg_mp_eps$_85,Superbe,& Rare Saab,,,,,,,,,,,,,,,,,,0,,{}
https://www.2ememain.be/v/autos/saab/m2345427866-saab-9-3-ttdi-aero-sw-cuir-navi-bose-sound,2345427866,fr,Saab 9.3 TTDi Aero SW cuir / navi/ Bose Sound,4900,EUR,,,,Saab 9.3 TTDi Aero Break SYSTÈME DE NAVIGATION EN CUIR BOSE SOUND Année 2008. 236 000 km Concessionnaire Saab spécialiste de la maintenance Carnet d'entretien et factures disponibles. Fonctionne parfaitement. Ventes de préférence aux passionnés de Saab.,2,https://images.2dehands.com/api/v1/listing-twh-p/images/b2/b2fac3b3-d68d-44c4-a904-32784f600d09?rule=ecg_mp_eps$_85|https://images.2dehands.com/api/v1/profile-twh-p/images/7a/7a8fd9ab-62a7-4c76-bd93-ba255c9e9ae6?rule=ecg_mp_eps$_82,Saab,9.3 TTDi Aero,2008,236000,,,,,,,,,,,,,,18,0.020763,0,,{}
https://www.2ememain.be/v/autos/saab/m2340825479-saab-9-3-cabriolet-uit-1999-te-koop,2340825479,fr,Saab 9-3 cabriolet uit 1999 Te Koop!,5900,EUR,,,,"Ik heb deze wagen iets meer dan 10 jaar gehad; nooit een accident mee gehad of problemen. Dus met veel pijn in het hart verkoop ik hem nu. Jaarlijks vlot door de keuring, steeds op onderhoud gegaan in een SAAB garage (SAAB SUPPLY) en is nog volledig origineel. Volgens de garage kan die makkelijk tot 350 000 - 400 000 kms gezien hij nog van het tijdperk pre-GM is en dus echt SAAB. Laatste volledige onderhoudsbeurt 05/2025. Geldig keuringsbewijs tot maart 2026. Ik heb een volledig onderhoudsbewijs-boekje. Uiteraard gebruiksporen, maar verder dan dat een fantastisch leuke wagen. Binnen 3 jaar oldtimer.",1,https://images.2dehands.com/api/v1/listing-twh-p/images/37/37674174-1733-443e-83ea-0c4804564333?rule=ecg_mp_eps$_85,Saab,9-3 cabriolet uit,1999,,,,,,,,,,,,,,,27,,0,,{}
https://www.2ememain.be/v/autos/saab/m2340049001-saab-9-3,2340049001,fr,Saab 9-3,1250,EUR,,,,Saab 9-3 embrayage a refaire et entretien moteur et les 2 poignées de portes avant interieur 2004 - 1800cc - euro4 A PRENDRE AVEC PLATEAU OU REMORQUE Prix à discuter 2 clés et documents presents PAS DE BATTERIE,2,https://images.2dehands.com/api/v1/listing-twh-p/images/77/7767066f-5717-45c4-a086-dff248f31e70?rule=ecg_mp_eps$_85|https://images.2dehands.com/api/v1/profile-twh-p/images/e3/e35b30c6-bb5a-4d95-801e-65fb0e41de05?rule=ecg_mp_eps$_82,Saab,9-3,2004,,,,,,,,,,,,,,,22,,0,,{}
https://www.2ememain.be/v/autos/saab/m2321173214-saab-1-9-ttid-vector,2321173214,fr,"Saab 1,9 TTID Vector",5995,EUR,,,,"Très belle Saab 9.3 1,9 TTID 2011 euro 5 160cv avec 199000 km. Six vitesses avec position sport.Contrôle technique vierge valable jusqu'à juin 2026. Carpass. Entretenue régulièrement chez un professionnel Saab. État carrosserie et mécanique impeccable. Jantes 18 avec nouveaux pneus Michelin 4 saisons. Hifi Bose 11HP Woofer. Boîte révisée, courroie distribution de 20000km. Nouveau gaz airco + entretien.Nouveaux disques, plaquettes, amortisseurs. Nouvelle batterie. Toutes les factures sont à disposition. 4 Jantes 17 pour pneus hiver. Attache remorque amovible. Siège conducteur légèrement usé. Je vend cette splendide Saab pour l'achat d'une nouvelle voiture. Cette voiture est dans un excellent état mécanique et carrosserie impeccable. Non fumeur et très propre. Elle restera dans un garage. Au départ le prix était de 7995 euros vu son état impeccable. Le prix demandé actuellement est largement en dessous de sa valeur réelle.",1,https://images.2dehands.com/api/v1/listing-twh-p/images/58/5803d282-2396-4dcc-a009-ee54f1bf105b?rule=ecg_mp_eps$_85,Saab,"1,9 TTID Vector",2011,199000,,,,,,,,,,,,,,15,0.030126,0,,{}
https://www.2ememain.be/v/autos/saab/m2323359658-saab-9-3-turbo-cabriolet-2002-kit-embrayage-remis-a-neuf,2323359658,fr,Saab 9-3 turbo cabriolet 2002 kit EMBRAYAGE REMIS A NEUF,2500,EUR,,,,"Saab 9-3 Turbo Cabriolet – 2002 • Embrayage complet refait récemment (kit + émetteur) chez garagiste • Gros entretien effectué il y a 1000–2000 km (bougies, filtres, vidange, etc.) • Capote en parfait état de fonctionnement • Intérieur en très bon état • Deux clés disponibles • Carpass complet avec historique du véhicule • Contrôle technique valable jusqu’en mai Quelques défauts à signaler : • Légères traces sur les pare-chocs avant et arrière • Deux petites zones de vernis parties (env. 4–5 cm) Voiture bien entretenue, fiable et prête à rouler.",2,https://images.2dehands.com/api/v1/listing-twh-p/images/dc/dc8332df-eed1-443d-92ed-67c7e5af6362?rule=ecg_mp_eps$_85|https://images.2dehands.com/api/v1/profile-twh-p/images/1d/1d90dfa2-1e0c-43c0-8e2c-3202b87bb027?rule=ecg_mp_eps$_82,Saab,9-3 turbo cabriolet,2002,2000,,,,,,,,,,,,,,24,1.25,0,,{}
https://www.2ememain.be/v/autos/saab/m2320497185-saab-9-3-vector-cabriolet-nette-auto-lpg,2320497185,fr,"Saab 9-3 vector cabriolet, nette auto, LPG!",7950,EUR,,,,"Orphyum biedt aan: Mooie goed onderhouden Saab 9-3 1.8t cabriolet in vector uitvoering en met een Prins G3 installatie. Goedkoop rijden dus in deze wintervaste cabriolet. Ook zakelijk is het daarmee een interessante auto want hij is natuurlijk inzetbaar als Youngtimer en je hebt geen gedoe met milieu zones! De lpg tank ligt op de plek van het reservewiel en de vulopening is netjes achter het tankklepje geplaatst. Liever geen lpg? Geen probleem, we kunnen de installatie ook demonteren zodat de auto alleen op benzine rijdt. Uiteraard zorgen we er dan ook voor dat dit officieel op het kenteken bij de RDW geregistreerd wordt De betrouwbare B207 1.8t motor levert 150 pk gekoppeld aan een handgeschakelde versnellingsbak waarmee hij meer dan prima meekomt in het verkeer. Wij hebben de auto zelf geselecteerd, ingekocht en geïmporteerd naar Nederland, distributie ketting al vervangen en een afleveringsbeurt gedaan. Bovendien zit een er lange APK op, de auto kan direct mee. Export naar België is geen probleem, we helpen u graag en leveren alle documenten daarvoor. Aflevering in België behoort ook tot de mogelijkheden. De auto heeft met 196.000 relatief weinig gelopen voor een LPG auto en dat is goed aan te auto te zien. Uiteraard zijn er de normale gebruikssporen die bij de leeftijd en kilometerstand passen maar het is over het algemeen een erg nette, goed rijdende wagen. De Vector uitvoering komt met een aantal prettige optie zoals cruise control, climate control, regensensor en parkeersensoren. Deze opties functioneren allemaal goed. Om de niet heel spannende kleurstelling wat te contrasteren hebben we de auto voorzien van mooie 18""alu 56 velgen met goeie merkbanden. Voordelig het hele jaar door in een cabriolet rijden? Hij staat in Slochteren klaar voor een bezichtiging en een proefrit bij serieuze interesse. Orphyum is een jong autobedrijf, gespecialiseerd in Saab en gevestigd in Slochteren, Nederland. Orphyum Hoofdweg 65 9621 AD Slochteren 06-54300172 Info@orphyum.nl We hebben ons uiterste best gedaan om alle informatie in deze advertentie correct weer te geven. Er kunnen echter geen rechten worden ontleend aan de verstrekte informatie in de advertentie. Vertrouw niet alleen op deze informatie maar controleer altijd zelf de zaken welke voor jou belangrijk zijn en je beslissing zouden kunnen beïnvloeden. Neem eventueel contact op voor aanvullende vragen.",1,https://images.2dehands.com/api/v1/listing-twh-p/images/ce/ce8f80ee-2a89-4448-ac79-084bc5cb836b?rule=ecg_mp_eps$_85,Saab,"9-3 vector cabriolet,",,,Benzin,,,,,,,,,,,,,,,0,,{}
https://www.2ememain.be/v/autos/saab/m2315563886-saab-9-3-tdid-boite-automatique-pret-a-immatricule,2315563886,fr,Saab 9-3 tdid Boîte Automatique Prêt à immatriculé,2199,EUR,,,,"Saab 9-3 tdid Boîte Automatique carnet d'entretien, de 2006 avec 249000km évolutif 1900cc 150cv, kit de distribution remplacer à 216000km Full options Véhicule très propre extérieur tout comme intérieur. Véhicule de non-fumeur. Avec intérieur cuir chauffant, Airco digitaal, cruise control, verrouillage central, feux antibrouillards, direction assistée, ABS, radio CD commandes au volant, capteur de recul, 4 vitres électriques, isofix, peinture métal, jantes alu... Avec le contrôle technique occasion pour la vente fourni avec sa demande d'immatriculation et son nouveau car pass : 2199€ Visible sur rdv",2,https://images.2dehands.com/api/v1/listing-twh-p/images/93/93f9e3af-7947-47fa-bb66-0260e5d41fff?rule=ecg_mp_eps$_85|https://images.2dehands.com/api/v1/profile-twh-p/images/53/53e290b2-c63f-495d-a200-111ccb6938d6?rule=ecg_mp_eps$_82,Saab,9-3 tdid Boîte,2006,249000,Electric,Automatic,,,,,,,,,,,,20,0.008831,0,,{}
https://www.2ememain.be/v/autos/saab/m2305212957-recherche-cabriolet-saab-de-2004,2305212957,fr,Recherché : cabriolet Saab de 2004,,EUR,,,,"Chères personnes, je suis un passionné néerlandais de Saab et je recherche un cabriolet Saab de 2004 à 2011 en version essence, de préférence automatique (la transmission manuelle est également autorisée) avec un intérieur en cuir beige (encore de bons sièges) (d'autres couleurs sont également autorisées) que j'utiliserai comme voiture donneuse (donc pour les pièces). Donc, si vous avez une voiture, un accident, si vous ne conduisez pas, si vous avez une épave ou si vous souhaitez vendre la voiture (vous obtenez un prix équitable, en fonction de l'état de la voiture), contactez-moi, s'il vous plaît avec votre e-mail/numéro de téléphone., brève description de la voiture. Merci d'avance. Salutations John",,,Recherché,: cabriolet Saab,2004,,Essence,Automatic,,,,,,,,,,,,22,,0,,{}
